place,country,google_maps_url,description,region,place_type,blog_source,romance,family,cost,nature,adventure,culture,food,relaxation,service,accessibility,description_count,last_updated
Five Ladies Expedition Rocks,China,https://surl.amap.com/69IdC0dp4X7,"Afterwards, you can continue along the cliffside path, taking in stunning views such as the  and many others. One of my favorite viewpoints here is the Hallelujah Mountain, which inspired the dreamy landscapes in the movie Avatar. The solitary vertical pillar rising amidst the picturesque scenery is truly a sight to behold.",,,,7,6,2,9,7,4,0,9,0,4,1,2026-04-08
Five-Color Lake,China,https://surl.amap.com/1uPbtTqp1g5CF,"It took me about 45 minutes to hike the steep section before arriving at the Qujiuzhaga Rest Stop and an intersection where you can choose to visit Milk Lake or . The trails are connected in a triangle shape, so you can choose either way and continue to the next one before the trail loops back to this intersection.",,,,1,3,2,10,9,3,1,7,2,6,1,2026-04-08
Five-Colored Pond,China,https://surl.amap.com/MZqYUyRA16M,"From the temple, it is only a few minutes' walk to the , arguably the most beautiful attraction in Huanglong Scenic Park. The pool sits high in the valley at about 3,576 meters above sea level and is considered the largest and highest outdoor travertine pond cluster in the world. It is also one of the most surreal sights in China, a place that made me wonder, ""How is this even real?""",,,,6,7,2,10,6,2,0,8,0,7,1,2026-04-08
Forest Sightseeing Cable Car,China,https://surl.amap.com/3rg2vtf1A4yb,"From Yunmeng Fairy Peak, you can either hike the longer route to Tianmen Temple or take the , an open-air, ski-style cable car that lets your feet dangle over cliffs and mountains. Riding it is an exciting experience in itself, in my opinion, and I highly recommend it.",,,,3,7,2,10,10,1,0,7,2,8,1,2026-04-08
Gateway to Heaven,China,https://surl.amap.com/8mwKOR97ln,"One of the most iconic features of Tianmen Mountain, which is probably the main reason why many travelers decided to visit, is the natural arch carved into the cliff face called Tianmen Cave, or popularly known as the “”. This enormous rock‑arch stands about 131.5 metres tall and around 57 metres wide, making it one of the largest natural arches at high altitude in the world.",,,,3,6,2,10,9,5,0,7,0,7,1,2026-04-08
Giant Buddha North Gate,China,https://surl.amap.com/1KR8BBctc9L,"If you prefer to skip the Oriental Buddha Park, you can take a taxi directly to the  and pay only 80 CNY for the Giant Buddha ticket. You can also buy tickets online here before your arrival. Be sure to bring your passport when purchasing or collecting tickets.",,,,0,0,4,0,2,2,1,1,2,7,1,2026-04-08
Giant Panda Research Base,China,https://surl.amap.com/1yvwPbc1wbdv,"Of course, when you visit Chengdu, one of the few pandas' natural habitats, you gotta come and see the Giant Pandas with your own eyes, and one of the best places to do so is at , located about 10 kilometers north of downtown Chengdu.",,,,2,6,4,10,9,7,1,7,5,7,1,2026-04-08
Glass Skywalk,China,https://surl.amap.com/lD4SKA1Z47j,"Another exciting activity is walking the , a transparent walkway that clings to the cliff face, allowing you to look straight down at the valleys hundreds of meters below. It’s definitely not for the faint of heart.",,,,2,4,2,9,9,0,0,6,0,4,1,2026-04-08
Glowing Waterfall,China,https://surl.amap.com/KKBzpU549Zy,"As you follow the winding boardwalk upward, you will come across the , a stunning cascade where water tumbles down a rocky ledge about 10 meters high and 60 meters wide. It forms dozens of tiered waterfalls that shimmer like silver pearls rolling down, resembling a sparkling curtain of water suspended high above.",,,,6,8,2,10,9,1,0,8,0,5,1,2026-04-08
Golden Whip Stream,China,https://surl.amap.com/6pK6ZuR1c7k8,"For those who want to hike down, make sure you have at least 2–3 hours to spare, as it will take that long to descend the mountain. You can choose between two trails. One is the , a beautiful path that follows a peaceful river, with pavilions along the way where you can rest. This route starts right at the end of Yuanjiajie Mountain, making it perfect if you are following my suggested route beginning with the cable car.",,,,2,5,2,10,9,0,0,8,1,6,1,2026-04-08
Gongacuo Lake,China,https://surl.amap.com/1qiN8bb32ct3,"From Luorong Cattle Farm, you have the option to begin hiking the main trail or hire a horse for 300 CNY per person to take you to , which is roughly halfway to Milk Lake and Five-Color Lake. In my opinion, this is unnecessary, as the trail from the cattle farm to  is flat, scenic, and enjoyable, and you would miss much of it if you take the horse.",,,,0,5,4,10,8,2,0,7,5,8,1,2026-04-08
Grand Waterfall Scenic Area,China,https://surl.amap.com/NA3zu8R144Ke,"First and foremost, I recommend starting your visit at the , home to the crown jewel of the park, the magnificent Huangguoshu Waterfall. After purchasing your ticket and entering the scenic area, take the shuttle bus from the ""Entrance to the  Carriage Way"" bus stop, which is located on the right-hand side.",,,,3,4,2,10,8,4,0,7,4,8,1,2026-04-08
Greatest Natural Bridge,China,https://surl.amap.com/f3SMHIZpaop,"The shuttle bus will drop you off at Tianqiao Bus Stop and from there, you can begin exploring Yuanjiajie Mountain starting with the , a rocky natural bridge that connects 2 mountain peaks together. On the peak, you will also find a temple where you can pay respect and enjoy all the viewpoints around the area.

The shuttle bus will drop you off at Tianqiao Bus Stop, and from there, you can begin exploring Yuanjiajie Mountain starting with the , a rocky natural bridge that connects 2 mountain peaks together with a vertical drop of a whopping 400 meters!",,,,4,6,2,10,10,6,0,7,4,7,2,2026-04-08
Guangzhou South Railway Station,China,,"From Guangzhou, you can take a high-speed train from  to Guilin North Railway Station. It costs around 20 USD and takes about 3 hours. You can book the ticket in advance here.",,,,5,5,10,5,5,5,5,5,5,5,1,2026-04-08
Guilin City,China,https://surl.amap.com/44EEg6li1wf,"After spending almost a week here, here’s my recommendation on where to stay in Guilin. First and foremost, you’ll need to get into  via high-speed train and stay at least one night. If you plan to visit the Longji Rice Terrace, consider staying two nights so you can take a day trip the next day. My recommended accommodations in  are listed below:

This itinerary begins in , which is well-connected by China’s high-speed rail network. High-speed trains run from major cities like Guangzhou, Shenzhen, Chengdu, and Shanghai, with travel times ranging from a few hours to overnight depending on your departure point.",,,,0,1,5,2,3,2,1,4,4,6,2,2026-04-08
Guilin Liangjiang International Airport,China,,"By Plane:  is the main gateway for flyers. The airport has frequent domestic flights from major cities like Beijing, Shanghai, Guangzhou, and Chengdu, as well as a few direct international flights from countries such as Thailand, Singapore, Malaysia, and South Korea. From the airport, it’s about 30 km to Guilin city center. You can take a taxi, which usually takes around 40–50 minutes, or hop on an airport shuttle bus for a more budget-friendly option.",,,,0,1,4,0,1,2,0,2,4,10,1,2026-04-08
Guilin North (Guilinbei) Station,China,,"By High Speed Train: Guilin is also well-connected by China’s high-speed rail network. High-speed trains arrive from cities like Guangzhou, Shenzhen, Chengdu, and Shanghai, with travel times ranging from a few hours to overnight depending on your departure point. The main high-speed hub is , while other stations serve different routes. You can book the ticket in advance here.

After taking the train from Guangzhou to Guilin, you will arrive at . From there, you can take public bus #22 to the city center for 2 CNY, which takes about an hour, or simply hail a Didi to go directly to your hotel.",,,,0,0,5,1,3,2,0,2,4,10,2,2026-04-08
Guiyang,China,,"After spending several days in Guilin, we will head to , the capital of Guizhou, one of China’s most underrated regions. We’ll use  as a base to explore the area’s stunning natural landscapes and rich cultural sites. The city itself is not particularly remarkable, but its slightly gritty character offers a glimpse of what life is like in a typical non-first-tier city in China.",,,,7,6,4,9,6,10,3,7,6,5,1,2026-04-08
Guiyang North Railway Station,China,https://surl.amap.com/qTP1Q0tJ6bS,"From Guiyang, you can take a high-speed train from  to Anshunxi Railway Station, which should take about 30 minutes and cost 47 CNY. You can book the train here.",,,,5,5,10,5,5,5,5,5,5,5,1,2026-04-08
Hallelujah Mountain,China,https://surl.amap.com/3bX6kLz4guA,"Afterwards, you can continue along the cliffside path, taking in stunning views such as the Five Ladies Expedition Rocks and many others. One of my favorite viewpoints here is the , which inspired the dreamy landscapes in the movie Avatar. The solitary vertical pillar rising amidst the picturesque scenery is truly a sight to behold.",,,,7,6,2,9,7,4,0,9,0,4,1,2026-04-08
Helong Park,China,https://surl.amap.com/55SETSd1h1kZ,"The main highlight of Tianzi Mountain is , which offers several incredible viewpoints where you can see some of the mountain’s most unique formations. One of the most famous is the Imperial Brush Peak, a pillar that resembles the tip of a paintbrush and looks especially surreal in the soft morning light.",,,,5,6,2,10,10,3,0,8,0,7,1,2026-04-08
Hongyao Stockaded Village,China,https://surl.amap.com/2ANZ2jRHs5Md,"Along the way, you will also stop at , home to the Yao ethnic minority. The village is famous for its well-preserved stilt houses and traditional wooden architecture. Interestingly, it is also the birthplace of the woman with the longest hair in China, who holds the Guinness World Record with hair measuring 5.627 meters (18 ft 5.54 in) as of May 2004.",,,,2,5,0,4,5,10,0,6,2,7,1,2026-04-08
Huanglong Temple,China,https://surl.amap.com/MR2PeQV1cdtt,"From Middle Temple, you can continue for another 15 minutes to reach the , a larger rest stop located just before the Five Colored Pool. It offers a much better view of the surrounding mountains compared to Middle Temple.",,,,3,5,4,9,7,8,0,8,1,6,1,2026-04-08
Huanglong–Jiuzhai Railway Station,China,https://surl.amap.com/sfs9aR6C01x,"To get here, you can take a train from Chengdu East Railway Station to , which takes about two hours. Be sure to book your train tickets together with your Jiuzhaigou entrance ticket at least three days in advance, as both sell out very quickly. You do not want to secure your park ticket but then find that the trains are fully booked, leaving you without a way to get there and back.

By Train: One of the most popular ways to get to Huanglong is to take a high-speed train from Chengdu. You can take a train from Chengdu East Railway Station to , which takes about two hours. Be sure to book your train tickets together with your Jiuzhaigou entrance ticket at least three days in advance if you are planning to go to Jiuzhaigou as well, as both sell out very quickly. You do not want to secure your park ticket but then find that the trains are fully booked, leaving you without a way to get there and back.",,,,0,0,4,0,2,0,0,2,2,8,2,2026-04-08
Imperial Brush Peak,China,https://surl.amap.com/fylpWw1A7KX,"The main highlight of Tianzi Mountain is Helong Park, which offers several incredible viewpoints where you can see some of the mountain’s most unique formations. One of the most famous is the , a pillar that resembles the tip of a paintbrush and looks especially surreal in the soft morning light.",,,,4,6,2,10,9,2,0,8,0,7,1,2026-04-08
Impression Lijiang,China,https://surl.amap.com/1IYbCVTQcWZ,"With the ticket I recommended, it also includes a ticket to see , an outdoor one-hour large-scale show performed by the local Naxi people, set against the dramatic backdrop of Yulong Snow Mountain.",,,,5,5,10,5,5,5,5,5,5,5,1,2026-04-08
Jianchuan,China,https://surl.amap.com/14IVQjrTK1AV,"This Bai ethnic village is located remotely in the mountains, which is why it still retains its authenticity. The only way to get there is by road, which is about 2-3 hours by car from Dali Ancient Town or 4-5 hours by public buses and minivan. These leave from Dali North Bus Station, and you will have to transfer to a minivan in .",,,,0,1,2,2,3,6,1,4,8,10,1,2026-04-08
Jinli Old Street,China,https://surl.amap.com/5qLcsJS6Dj,"Another must-visit historical district in Chengdu is . It is a more stylized, newly renovated area featuring beautiful lanterns and lights, plenty of recreational spaces such as a square with outdoor restaurants, live music, and more. The street is more focused on street food and shops rather than historic buildings, unlike Kuanzhai Alley. Both districts are worth visiting in my opinion.",,,,4,4,4,1,1,9,5,8,5,7,1,2026-04-08
Kaili South Railway Station,China,https://surl.amap.com/u3ShVWVgHo,"From Guiyang, you can take a high-speed train from Guiyang North Railway Station to , which should take about 30 minutes and cost 58 CNY. You can book the train here.",,,,5,5,10,5,5,5,5,5,5,5,1,2026-04-08
Kowloon-Canton Railway Clock Tower,China,,"You can come to the harbour about an hour before sunset and go check out some of the tourist attractions nearby like the , one of Hong Kong's iconic landmarks. Once you are done, you can go up the elevated bridge over the pier, find a place to sit, and enjoy the wonderful light shows at sunset.",,,,7,5,2,10,7,5,1,9,3,4,1,2026-04-08
Kuanzhai Alley Scenic Area,China,https://surl.amap.com/rCNhnFLSdeF,"Another great place to hang out at night is , one of the best-preserved traditional street districts in Chengdu, located in the Qingyang District not far from Tianfu Square.",,,,5,5,10,5,5,5,5,5,5,5,1,2026-04-08
Langde,China,https://surl.amap.com/wXvMXR791AM,"That said, like many places in China, Xijiang Village has become somewhat commercialized, and some travelers prefer smaller, more authentic villages such as  or Rongjiang. Even so, I still believe Xijiang is one of the most beautiful Miao villages and well worth a visit.",,,,3,4,6,7,4,8,1,7,4,6,1,2026-04-08
Lao Zhai Shan Hill,China,https://surl.amap.com/PbRMd4hR5fS,"Probably one of the most beautiful viewpoints in Guilin,  is a steep karst mountain located right next to Xingping Ancient Village. You can hike up to see the stunning Li River winding around the jagged peaks of Guilin's karst landscape.",,,,5,6,4,10,8,3,0,8,0,7,1,2026-04-08
Leshan Giant Buddha,China,https://surl.amap.com/q3SwavHy8Rn,"Another excellent day trip from Chengdu is a visit to the , one of Sichuan’s most iconic landmarks. The massive Buddha statue stands over 71 meters tall, making it the largest in the world, and is carved directly into a cliff face at the confluence of the Min, Dadu, and Qingyi Rivers.

From Oriental Buddha Park, you should be able to hike straight to , which is connected via a set of stairs that you will have to hike to get to. It's very long, and you should arrive at the viewpoint where you can see  from above in no time.",,,,2,4,3,10,8,5,0,6,0,7,2,2026-04-08
Leshan Railway Station,China,https://surl.amap.com/9HrR4kj1444m,"By High-Speed Train: High-speed trains depart from Chengdu East, Chengdu South, and Chengdu West Stations, arriving at . Once you arrive, you can take a local bus or taxi to the Leshan Giant Buddha Scenic Area. A Didi ride takes about 20 minutes, while the bus takes around 40 minutes depending on traffic.",,,,0,1,4,6,7,0,0,5,5,10,1,2026-04-08
Lijiang Old Town,China,https://surl.amap.com/r7vJ7lOcr7,"is the heart of the city and one of the best-preserved ancient towns in China. With its cobbled streets, traditional Naxi architecture, and flowing canals, it feels like you are stepping back in time. The town has a maze-like layout, full of narrow alleyways, small bridges, and quaint courtyards, and you never know what beautiful hidden corners lie beyond them. It’s truly a wonderful place to explore.",,,,9,7,4,6,5,10,4,10,6,3,1,2026-04-08
Lijiang Railway Station,China,https://surl.amap.com/IR8EdfSgHr,"By Train: Lijiang is also connected by high-speed trains. The most popular routes are from Kunming, which takes around three hours, from Dali, which takes one to one and a half hours, and from Shangri-La, which takes about one hour. Trains arrive at , located about 15 to 20 minutes from Old Town and you can get a Didi to your accommodation. You can book the train here.",,,,1,1,6,0,3,2,1,3,6,10,1,2026-04-08
Lijiang Sanyi International Airport (LJG),China,https://surl.amap.com/6vLS3A18eh0,"By Plane:  is the main gateway into the city. Direct flights operate from major Chinese cities such as Kunming, Chengdu, Chongqing, Guangzhou, Beijing, and Shanghai. From the airport, it takes about 30 to 40 minutes to reach Lijiang Old Town by taxi or DiDi. There is also an airport shuttle bus that runs to Lijiang Old Town and Blue Sky Hotel.",,,,0,1,6,2,3,3,0,4,7,10,1,2026-04-08
Lingbao Pagoda,China,https://surl.amap.com/2hApQe1kb92,"Once you arrive back at the top, you can spend the rest of your time exploring the temples and shrines around Giant Leshan Buddha like the beautiful , Lingyun Temple, and more. You can also go and take a cruise along the river to see the Giant Leshan Buddha from the river, if you have the time.",,,,3,5,2,8,8,10,0,7,2,7,1,2026-04-08
Lingyun Temple,China,https://surl.amap.com/19kIIm2d16bUp,"Once you arrive back at the top, you can spend the rest of your time exploring the temples and shrines around Giant Leshan Buddha like the beautiful Lingbao Pagoda, , and more. You can also go and take a cruise along the river to see the Giant Leshan Buddha from the river, if you have the time.",,,,3,6,4,9,8,10,0,7,1,7,1,2026-04-08
Longevity Palace,China,https://surl.amap.com/1avHiy1149HH,"Last but not least, be sure to visit the , located in the Shawan area just outside the East Gate of Fenghuang Ancient Town. The palace faces the river and is backed by hills, and you will immediately notice its iconic red building behind a tall pagoda as you enter the ancient town.",,,,3,4,0,7,5,10,0,4,0,7,1,2026-04-08
Longji Rice Terrace,China,https://surl.amap.com/Kcmjj3v1f9mu,"Last but not least, if you are looking for a great day trip to take from Guilin City, you are going to love . The place is another iconic attraction that is located about 2 - 3 hours away from Guilin City, with its beautiful rice paddies climbing up the slopes of the karst mountains in intricate layers.",,,,5,4,2,10,7,7,1,8,1,4,1,2026-04-08
Longtoshun Wharf,China,https://surl.amap.com/1r27r2zjc9Lf,"Once you arrive at the pier, your guide will purchase the ticket for you, and you can board the boat according to the boat and seat number provided. The boat usually departs around 10 AM, and you should arrive at  by 2 PM, making the journey approximately four hours, six hours in total including bus transfers and boarding.",,,,0,1,2,4,5,3,1,5,8,9,1,2026-04-08
Lotus Terrace Waterfall,China,https://surl.amap.com/KZ5dOdXgeGl,"The  is another beautiful waterfall you will encounter while hiking up the trail. It is located at around 3,240 to 3,270 meters above sea level, spans 167 meters in length, 19 meters in width, and has a vertical drop of 25 meters.",,,,3,7,2,10,10,0,0,7,0,7,1,2026-04-08
Luorong Cattle Farm,China,https://surl.amap.com/l1wnhNDbNX,"Once you arrive at , you will be greeted by beautiful open grasslands where horses and cattle roam freely, with the snow-capped peaks of Yading towering all around.",,,,5,5,10,5,5,5,5,5,5,5,1,2026-04-08
Macao Museum,China,,"The fort is surrounded by a beautiful park, and it’s just a short hike up from the Ruins of Saint Paul’s before you reach its formidable gate, making it a perfect stop after visiting the ruins. Inside the fort, you’ll also find the , where you can learn all about the fort’s history as you explore.",,,,1,4,2,8,7,10,0,6,3,8,1,2026-04-08
Macau International Airport (MFM),China,,"Since this itinerary begins in Macau, you can either fly directly to , which is served by airlines like AirAsia, which has great coverage in Asia.",,,,5,5,10,5,5,5,5,5,5,5,1,2026-04-08
Macau Outer Harbor,China,,"From Macau, you can take a high-speed ferry from the  to the Hong Kong Macau Ferry Terminal. From the city center, you can catch bus #3A to the , which takes about 25 minutes and costs 5 MOP/HKD. The ferry costs around 200 HKD and takes just under an hour. You can book your ticket in advance here.",,,,0,0,4,0,1,1,0,1,6,10,1,2026-04-08
Mandarin's House,China,,"In the afternoon, you can continue south, and you will find , a historic residential complex, once home to Zheng Guanying, a prominent 19th-century Chinese scholar and reformist, where you can stroll around and admire its beautiful decorations and artifacts.",,,,3,4,0,1,3,10,0,5,2,7,1,2026-04-08
Middle Station,China,https://surl.amap.com/3ThbeO7fxaFT,"One of the reasons I recommend choosing Route B over the others is the stunning view from the , especially if you arrive early in the morning. I highly recommend going early to avoid crowds and enjoy the best visibility, as fog tends to build up later in the day, especially during summer.",,,,3,2,2,9,7,1,0,7,0,5,1,2026-04-08
Middle Temple,China,https://surl.amap.com/MXPU7hD19bta,"After about two hours of hiking, you should arrive at the , an inaccessible temple that also serves as a rest stop. You can take a break here, as there are many seating areas and a few shops selling snacks to keep you going. Since it is so close to Huanglong Temple, the next stop, I suggest you push through this rest stop and rest at Huanglong Temple for a better view of the place.",,,,2,5,4,8,7,9,0,7,4,9,1,2026-04-08
Milk Lake,China,https://surl.amap.com/1uEG2b5T1ugZ7,"It took me about 45 minutes to hike the steep section before arriving at the Qujiuzhaga Rest Stop and an intersection where you can choose to visit  or Five-Color Lake. The trails are connected in a triangle shape, so you can choose either way and continue to the next one before the trail loops back to this intersection.",,,,1,3,2,10,9,2,1,7,2,7,1,2026-04-08
Mirror Reflection Pool,China,https://surl.amap.com/Lb683K1kayZ,"Next, you will find the , a smooth and beautiful pool located around 3,400 meters above sea level. The water is so calm and still that it earned the name , and you will find a collection of over 180 pools in this area.",,,,5,8,2,10,6,2,0,8,3,8,1,2026-04-08
Monte Fort,China,,"Located right next to the Ruins of Saint Paul's, you will find , a historic fortress built by the Portuguese in the early 17th century on top of a hill overlooking the entire old town area to protect Macau from invasions. Be sure to go and hike up to it in the morning when it is not too hot.",,,,3,4,2,10,8,10,0,6,0,7,1,2026-04-08
Moon Bay Parking Lot,China,https://surl.amap.com/43B2DUDap1GZ,"By Shuttle Service from Jiuzhaigou: If you decide to explore Jiuzhaigou on the first day and want to get to Huanglong from there, you can book a shuttle service here under ""Jiuzhaigou- Huanglong Attraction Shared Transfer"". It costs around 8 USD per person one-way, with departures from 7 AM to 1 PM almost every hour, usually from . Once you book, the travel agency will send you the exact pickup location and vehicle license plate via WeChat, so keep an eye out for the message.

The night before, I booked a shuttle service (the one listed under “Jiuzhaigou –Huanglong Attraction Shared Transfer”) for 8 USD. Around 9 PM, they sent me the pickup time, location, and the bus license plate. The next morning, I woke up early, headed to the pickup point at , and caught the 7 AM bus to Huanglong.

Getting Jiuzhaigou to Huanglong: After you are done exploring Jiuzhaigou on the first day, you can book a shuttle service here under ""Jiuzhaigou-Huanglong Attraction Shared Transfer"" and take it to Huanglong the next morning. It costs around 8 USD per person one-way, with departures from 7 AM to 1 PM almost every hour, usually from .",,,,0,0,5,1,2,1,0,2,5,9,3,2026-04-08
Moonlight Square,China,https://surl.amap.com/1qC3YBn13aVo,"If you time your visit to coincide with the evening gatherings, it is a unique opportunity to experience the warmth, rhythm, and traditions of Shangri-La firsthand that you can't find anywhere else in China but here, so be sure to come and check out Sifang Street Square and  after sundown.",,,,6,4,2,3,2,10,5,8,6,5,1,2026-04-08
Mu Fu Mansion,China,https://surl.amap.com/44bgFl2xKffo,"One of my favorite places in Lijiang Old Town has got to be , once the seat of the Mu family, the hereditary Naxi chieftains who ruled Lijiang for about 470 years through the Yuan, Ming, and Qing dynasties. It stands at the foot of Lion Mountain right at the center of Lijiang Old Town, and its architecture reflects not just Naxi traditions but also strong Han‑style palace design.",,,,4,5,2,3,3,10,0,8,6,8,1,2026-04-08
Nan Lian Garden,China,,"After you are done here, you can take the metro and go visit , a beautiful Chinese garden with stunning temples located in the Wong Tai Sin District that feels more like Japan than Hong Kong.",,,,5,5,10,5,5,5,5,5,5,5,1,2026-04-08
Nanhua Bridge,China,https://surl.amap.com/1KwZfTDo98Y,"When I visited, the lights were turned on around 6:30 PM, and I found the best view was , overlooking the entire town. People start gathering here and throughout the town to watch the lights come on, so be sure to be ready when it happens.",,,,4,4,2,7,3,5,1,8,2,4,1,2026-04-08
