place,country,google_maps_url,description,region,place_type,blog_source,romance,family,cost,nature,adventure,culture,food,relaxation,service,accessibility,description_count,last_updated
Naxi Embroidery Institute,China,https://surl.amap.com/19IWiWd3Deyr,"Beyond the murals, Baisha is also a living museum of Naxi culture. Its ancient streets are lined with traditional wooden and stone houses, old temples, and quiet courtyards. In the past, Baisha was a center for silk embroidery and traditional weaving, and nowadays you can visit the  to see skilled artisans at work.",,,,4,6,6,4,4,10,2,8,5,7,1,2026-04-08
No. 1 Wind & Rain Bridge,China,https://surl.amap.com/44XNozCAsc1d,"Some of the best views in the village are not found on the main street but along the river. If you want to explore this area, I highly recommend starting and ending at either  or No. 7 Wind & Rain Bridge. These are stunning old bridges with unique architectural designs, located at both ends of the village.",,,,5,4,2,9,6,10,0,8,0,5,1,2026-04-08
North Gate Wharf,China,https://surl.amap.com/fUIA0kFb9HF,"To go boating along the Tuojiang River, you can book your ticket here under ""Boat ticket."" You can choose a day cruise for 76 CNY or a night cruise for 138 CNY, and board from either the  or the Wanshou Wharf. The ride takes about 25 minutes. The day cruise runs from 8 AM to 5:50 PM, while the night cruise operates from 6:30 PM to 11 PM.",,,,0,2,2,7,7,2,0,6,9,10,1,2026-04-08
Nuorilang Waterfall,China,https://surl.amap.com/blnsy9ZRg8l,"is one of Jiuzhaigou’s most iconic sights and also one of the most crowded areas in the park. Located at an elevation of about 2,365 meters, it spans 320 meters in width and plunges roughly 24.5 meters. Its Chinese name comes from Tibetan, meaning “majestic and splendid”, which perfectly describes how I felt when I first saw it in person.",,,,5,5,2,9,8,7,0,8,2,8,1,2026-04-08
Old Town Waterwheel,China,https://surl.amap.com/axVXPZR8VU,"As I mentioned earlier, Lijiang Old Town is massive, and I almost missed visiting the , located right at the main entrance. I know 😅. In my defense, I didn’t enter from that side since my hotel was on the north side. It’s amazing to think that I nearly missed this beautiful town square, where many of the town’s events are held!",,,,4,4,4,1,4,10,2,5,6,9,1,2026-04-08
Oriental Buddha Park,China,https://surl.amap.com/7qiPkGI1uaYK,"For this itinerary, we are going to spend half a day not only visiting the Giant Leshan Buddha but also exploring , a lush green park full of incredibly beautiful and stunning rock-carving Buddha statues scattered across the mountains. This is where we will start this itinerary before we head over to the Giant Leshan Buddha.",,,,4,6,4,9,8,10,0,7,0,6,1,2026-04-08
Oriental Buddha Park East Gate,China,https://surl.amap.com/hBAziYpDgO0,"From Leshan Train Station, you can use Didi or a taxi to reach the , where you can purchase a combined ticket for both the Oriental Buddha Park and the Giant Leshan Buddha. The total cost is around 160 CNY.",,,,0,3,4,5,4,5,1,5,9,10,1,2026-04-08
Panda Lake,China,https://surl.amap.com/1S08RTKN9zf,"sits at around 2,587 m elevation and is another mirrored turquoise lake that is reachable on foot from Arrow Bamboo Lake so you do not need to take another bus to get to. You can stroll along its lakeside trail and it should take you all the way to  Waterfall, another must-see here.",,,,5,5,2,10,7,0,0,8,0,8,1,2026-04-08
Panxi S Bay,China,https://surl.amap.com/uDdwBNr16eY0,"By Cycling: Once you are near Erhai Lake, you can rent a bicycle from tourist hotspots around the lake like  and you can ride along its bank and enjoy the scenery. It should cost around 30-40 CNY to rent a bike for a day here.",,,,2,4,2,9,10,0,0,6,3,8,1,2026-04-08
Pearl Lake,China,https://surl.amap.com/1yGCHHQtMgfa,"After you have explored the beautiful Chonggu Temple, you can begin the hike to , which is the lowest holy lake in Yading at 4,100 meters above sea level and 0.75 acres formed by the melting snow on Xiannairi Mountain.",,,,3,6,2,10,8,6,1,7,2,5,1,2026-04-08
Performance Stage,China,https://surl.amap.com/ZyETgyl16dfS,"You can also attend the ""Beautiful Xijiang"" show to see many of these performances in one place at the . The show takes place every day at 11 AM, and ticket prices range from 80 to 150 CNY per person, depending on your seating choice in the theatre.",,,,2,4,4,0,3,8,1,5,6,8,1,2026-04-08
Potatso National Park,China,https://surl.amap.com/x9yNhY1166SW,"One of the best day trips you can take from Shangri-La is to visit , also known as Pudacuo National Park. This breathtaking nature reserve is located about 22 km northeast of Shangri-La at an elevation of roughly 3,500 meters, where beautiful alpine lakes, wetlands, forests, and grasslands are waiting for you to explore.",,,,5,7,2,10,8,1,0,8,0,8,1,2026-04-08
Prayer Wheel,China,https://surl.amap.com/iTbZrX211aFJ,"One of the most iconic landmarks you will see right away the moment you arrive at Dukezong Ancient Town is the massive gold-colored  located on top of Turtle Hill, right next to Dafo Temple. Standing at 21 meters high and weighing about 60 tonnes, it’s considered to be the largest prayer wheel of its kind in the world.",,,,3,5,2,10,8,9,0,7,0,7,1,2026-04-08
Qifeng Square,China,https://surl.amap.com/gUJRzQlP5gd,"There should be a clear sign as soon as you exit the terminal directing you to the shuttle bus area. You can buy a ticket from the kiosk inside the railway station, then proceed straight to the bus stop and board the shuttle. The ride costs about 7 CNY per person and drops you off at , from where you can walk to the ancient town.",,,,0,0,4,1,0,2,0,3,4,10,1,2026-04-08
Qujiuzhaga Rest Stop,China,https://surl.amap.com/1uN5Km9z1t4Zg,"It took me about 45 minutes to hike the steep section before arriving at the  and an intersection where you can choose to visit Milk Lake or Five-Color Lake. The trails are connected in a triangle shape, so you can choose either way and continue to the next one before the trail loops back to this intersection.",,,,2,3,4,10,9,3,1,7,2,6,1,2026-04-08
Rainbow Bridge,China,https://surl.amap.com/19avUu1GfkG,"Another bridge I really like is , which is likely the first bridge you will cross as it serves as a gateway between the newer part of the city and the old town. When I visited, the bridge was under renovation, but I was still able to walk across it and enjoy views of the lively shops and streets inside the old town.",,,,2,2,4,6,5,9,0,7,1,8,1,2026-04-08
Reed Lake,China,https://surl.amap.com/2ncrMa0u4kK,"After Shuzheng Village, you can stop by at , a beautiful lake known for its dense beds of reeds that sway gently in the wind. A clear, jade-colored brook, which is often called the “Jade Ribbon”, meanders through the reeds and divides the lake into two halves.",,,,7,9,4,10,5,3,0,9,2,8,1,2026-04-08
Reflection Pool,China,https://surl.amap.com/sS62Pqh1i5p0,"Right around the corner of the Three Pagoda, you will find the  where you can get that epic shot of the Three Pagodas reflecting on the calm water of the pool. Be sure to go there and take some photos before continuing to explore Chongsheng Temple Complex.",,,,3,3,2,8,7,9,0,7,3,7,1,2026-04-08
Rhinoceros Lake,China,https://surl.amap.com/2bCaBY8X4Sq,"After visiting the waterfall, you can take the shuttle bus to , located at the lower end of the Y. If time allows, you could instead take a shuttle from the Central Station to the other branch of the Y and explore sights like Long Lake and Five-Color Pond. I didn’t have time to visit that branch, so I chose to continue down toward the exit, stopping at  along the way.",,,,2,3,4,9,8,4,0,8,4,8,1,2026-04-08
Rongjiang,China,https://surl.amap.com/x6Yp0CJfcfY,"That said, like many places in China, Xijiang Village has become somewhat commercialized, and some travelers prefer smaller, more authentic villages such as Langde or . Even so, I still believe Xijiang is one of the most beautiful Miao villages and well worth a visit.",,,,3,3,6,7,4,8,1,7,4,6,1,2026-04-08
Ruyi Peak,China,https://surl.amap.com/1aEngHyl1t2AM,"If there's one thing I recommend you do when you are in Yangshuo, it is to go and explore , where you can take a cable car up to one of the highest karst mountains in the area and enjoy a 360° panoramic view while being surrounded by hundreds of other karst peaks. Out of all the places I visited when I was in Yangshuo, this is my favorite.",,,,5,5,2,10,10,2,0,7,1,7,1,2026-04-08
Sedano Square,China,,"Next up, you can come and visit , a UNESCO World Heritage site that connects many of Macau’s top attractions, including the Ruins of Saint Paul’s and Monte Forte, via a lively shopping street.",,,,5,5,10,5,5,5,5,5,5,5,1,2026-04-08
Seven Star Park,China,https://surl.amap.com/1bsi57zvKgcr,"If you found Elephant Trunk Hill a little too crowded and you would prefer a place that doesn't get as many tourists, you might also want to check out , the largest park in Guilin City, full of hidden hiking trails, unique-looking rock formations, and a beautiful cave to explore. It is the perfect place to escape the crowds in Guilin City.",,,,3,6,2,10,9,0,0,7,2,8,1,2026-04-08
Shangri-La,China,https://surl.amap.com/13M0lR11of4m,"The best place to stay when visiting Yading is the town of , previously known as Riwa and not to be confused with  City in Yunnan. This small town sits right at the entrance of Yading Nature Reserve and offers a good range of accommodation options at various price points. This is where I stayed during my visit. Below are some recommended places to stay:",,,,3,3,4,8,5,7,3,8,7,5,1,2026-04-08
Shangri-La Bus Station,China,https://surl.amap.com/dxJjTuDtbfw,"As I was wrapping up my trip in Shangri-La City in Yunnan, not to be confused with Shangri-La in Sichuan, which is where we’re heading next, I took a taxi to  the day before my departure to buy a bus ticket to Yading. These tickets cannot be booked online unless you’re a local, so make sure to purchase yours in advance to secure a seat on the morning bus.",,,,0,2,4,1,4,4,1,3,7,8,1,2026-04-08
Shangri-La Town,China,https://surl.amap.com/13M0lR11of4m,"From the airport, it takes about two hours to reach , and you will need to arrange a pick-up with your accommodation before you arrive. Do not expect to find buses or taxis waiting at the airport due to how remote it is. A taxi from the airport to  typically costs around 400 CNY per car.",,,,1,0,4,0,0,1,0,1,4,9,1,2026-04-08
Shaxi Ancient Village,China,https://surl.amap.com/FymbZmJa6mf,"I would recommend staying at least 2 nights, giving you one full day to explore. If you want to relax more and take a day trip to visit , consider staying 3 nights and 2 days, or even spending a night in Shaxi to fully immerse yourself in the village.",,,,2,2,4,7,6,3,0,7,0,2,1,2026-04-08
Shudu Lake,China,https://surl.amap.com/KfgFns91d6pX,"The second stop is one of the park’s most stunning features, which is , an alpine lake perched at around 3,705 m above sea level. The lake is surrounded by raised wooden boardwalks that you can stroll around and enjoy the peaceful nature and mountain views.",,,,7,8,2,10,7,1,0,10,1,8,1,2026-04-08
Shui'edi Pier,China,https://surl.amap.com/1uhwheVt95g,"Another fun activity you can do in Yangshuo is to hire a Bamboo Raft and explore the Yulong River, which is smaller than the Li River and a bit more peaceful. There are several routes you can take but the most popular one is from  to Gongnong Bridge, which I recommend you do.",,,,2,6,4,10,8,0,0,7,1,7,1,2026-04-08
Shuzheng Village,China,https://surl.amap.com/qG5MmCN1n09X,"If you are looking for a place to stop and take a break, you can get off at , a traditional Tibetan-Qiang village with more than 400 local residents. Here, you will see many beautiful buildings highlighting the unique wooden Tibetan architectural style, colorful decorations, and religious touches.",,,,3,4,2,5,2,10,1,6,2,5,1,2026-04-08
Sifang Street Square,China,https://surl.amap.com/3gje5m0kfLT,"As I mentioned earlier, one of the coolest traditions of the Naxi people that you can experience while here is the Bonfire dance ritual which often takes place at  around 6:30 PM to 7 PM every day.

If you time your visit to coincide with the evening gatherings, it is a unique opportunity to experience the warmth, rhythm, and traditions of Shangri-La firsthand that you can't find anywhere else in China but here, so be sure to come and check out  and Moonlight Square after sundown.",,,,6,4,6,5,4,8,6,6,5,4,2,2026-04-08
Sik Sik Yuen Wong Tai Sin Temple,China,,"Once that is done, you can continue on to one of the most sacred temples you can visit in Hong Kong, which is , a large and highly revered temple where you’ll see both worshippers and tourists seeking blessings for health, fortune, and success.",,,,0,3,2,1,4,10,0,5,6,9,1,2026-04-08
Snow Bridge,China,https://surl.amap.com/1870pgFa4ER,"One of my favorite bridges here is , which is located right next to Nanhua Bridge. It is one of the most recognizable landmarks here with its beautiful arch design and the 2-level pavilion that you can also climb for a great viewpoint over the river. This is also a good place to watch the town light up if you do not want to climb up Nanhua Bridge.",,,,6,6,2,10,7,4,0,8,0,8,1,2026-04-08
Songzanlin Monastery,China,https://surl.amap.com/r55Pdgp1x6e0,"is probably one of the most famous landmarks in Shangri-La and it is one of my favorite places in the city. This beautiful monastery sits about 5 km north from Shangri-La at an elevation of roughly 3,380 meters and it is considered the largest Tibetan Buddhist monastery in Yunnan, so much so that some people often refer to it as the ""Little Potala Palace"". This is as close to Tibet as you can get without having to go on an expensive organized tour.",,,,5,5,2,4,5,10,1,9,8,8,1,2026-04-08
Songzanlin Monastery Ticket Office,China,https://surl.amap.com/2MqNbv71k6D8,"To get here, you will first have to take a Didi taxi to the  and then you can get the ticket at the ticket office for 75 CNY per person. The ticket should also include the shuttle bus taking you to and from the monastery entrance. Once you have the ticket, you can proceed to the shuttle bus and it will take you there in 10 minutes.",,,,0,1,4,0,0,1,0,1,7,10,1,2026-04-08
South Gate,China,https://surl.amap.com/w6svVAsM4jP,"I highly recommend visiting Dali Ancient Town at night, when the streets come alive with both locals and travelers gathering to eat, shop, and enjoy the lively atmosphere. If you are looking for something to eat, the street in front of the  turns into a street food haven, with both sides lined with food carts. I often take an evening walk here to enjoy dinner and soak in the vibrant atmosphere.",,,,4,4,6,5,3,8,8,10,5,4,1,2026-04-08
St. Dominic's Church,China,,"You can go for a stroll and explore the surrounding streets which should lead to other tourist attractions in the area like , a stunning pastel-yellow Baroque-style church, Cathedral of the Nativity of Our Lady, and more.",,,,6,7,6,7,4,10,1,10,5,5,1,2026-04-08
Sun and Moon Pagodas,China,https://surl.amap.com/1bR5SvTv1t3i4,"For those who decide to stop at Guilin City, I highly recommend you go and visit , also known as the Twin Pagodas, one of Guilin’s most iconic landmarks. Located in the middle of Shanhu (Shan Lake), right in the heart of the city, the pagodas are especially beautiful at night when they are illuminated and reflected on the still lake surface.",,,,6,6,0,10,5,10,0,8,1,6,1,2026-04-08
Swan Lake,China,https://surl.amap.com/pQ3BHQ11k1lH,"To help you navigate Jiuzhaigou easily, I will list the best places to visit in the order I explored them, starting from the right-hand side of the Y, which is how the park is laid out with the entrance at the bottom. The shuttle bus takes you from the bottom of the Y to one of the branches, and a friend of mine recommended starting with the right branch over the left because there are more attractions to see there, beginning at the top with .

Either way, the bus will first take you to the central station, and then continue to the end of that branch without any stops. I recommend starting from the right branch over the left because there are more attractions to see there, beginning at the top with .",,,,1,2,5,5,6,5,0,5,4,8,2,2026-04-08
Tian Tan Buddha,China,,"In the afternoon, you can go and visit one of the most impressive landmarks in Hong Kong, , also known as the Big Buddha. This monumental bronze statue on Lantau Island is about a two-hour metro and cable ride from Central, which makes for a great half-day trip.",,,,4,5,2,7,6,10,0,6,0,7,1,2026-04-08
Tianbo Mansion,China,https://surl.amap.com/4ROj3m1Hn1qr,"Unless you plan to stay overnight in the park, you can ignore this stop and continue on for about 10 minutes to the next stop, which is Yangjiajie, where you can hike around a bit and visit places like , etc.

After this stop, the bus will continue for about 10 minutes to the next stop, which is Yangjiajie, where you can hike around a bit and visit places like , etc.",,,,3,4,6,7,6,2,2,6,3,5,2,2026-04-08
Tianfu Square,China,https://surl.amap.com/5mrapk71d5BJ,"is a large open plaza surrounded by government buildings, shopping streets, and cultural sites. At its center stands the iconic Statue of Mao Zedong, surrounded by colorful flower beds and artistic sculptures, all beautifully illuminated by the neon lights of the city.",,,,8,7,2,6,3,10,0,9,3,5,1,2026-04-08
Tianlongbabu Film and Television City,China,https://surl.amap.com/2OWGVvZ1c5gc,"is a large, themed film set and tourist attraction located right next to the Ximatan Cable Car Station to Cangshan Mountain, which makes for a great place to drop by and check out after you are done hiking the mountain. It was originally built for the filming of the famous Jin Yong (Louis Cha) martial arts drama Demi‑Gods and Semi‑Devils.",,,,2,5,2,9,9,7,0,8,3,9,1,2026-04-08
Tianmen Mountain,China,https://surl.amap.com/11rC2E4l1p0,"Now that we are done with the national forest park itself, let's go and check out other Zhangjiajie Attractions starting with , which is located right next to Zhangjiajie City. From Wulingyuan, after you are done with the forest park, I highly recommend you check out of the hotel there, take a taxi to Zhangjiajie City, and spend at least a night or 2 here, so you can explore , and more.

On your second day, you can wake up as early as 6:30 AM and use Didi to get yourself a taxi to Zhangjiajie City, where we will be spending our second day. It should take about 40 minutes to get to the city, and you can head over to your hotel early, drop your bags, and head out to catch a cable car to .",,,,0,2,4,6,6,4,1,6,4,9,2,2026-04-08
Tianmen Temple,China,https://surl.amap.com/4eO5sLzf1eb9o,"You can take the longer route first, which loops around the hill toward  and leads you past several scenic spots, including the Glass Walkways, the suspension bridge, and plenty of stunning viewpoints along the way. Once you arrive at , you can take the open-air cable car to Yunmeng Fairy Peak, enjoy the view from there, take the elevator down, and you will arrive back at the Upper Station.

Last but not least, you haven't seen Tianmen Mountain unless you make your way to , a stunning Buddhist temple located at the summit of Tianmen Mountain where you will find a series of halls, pavilions, and other traditional Buddhist-temple buildings you can explore.",,,,2,5,2,8,8,6,0,6,2,7,2,2026-04-08
Tianxingqiao Scenic Area,China,https://surl.amap.com/T7fIokdTaPk,"After visiting Doupotang Waterfall, take the shuttle bus to , my personal favorite. Unlike the Grand Waterfall, which is all about sheer scale, Tianxingqiao is known for its dramatic karst formations, natural bridges, and clear rivers. The area offers a variety of landscapes and walking trails, which I absolutely love exploring.",,,,4,7,2,10,8,4,0,8,0,8,1,2026-04-08
Tiger Leaping Gorge,China,https://surl.amap.com/waXM0qB1o5Pv,"Last but not least, you can take a day trip to visit  or spend two days hiking along the gorge and staying in villages along the way. I didn’t have time for the full hike and only visited the scenic area on a half-day trip, but it comes highly recommended by my friend who has explored China extensively.

Last but not least, if you are planning to visit Lijiang after, you can go and visit  on your way to Lijiang with this organized shuttle service which departs Shangri-La at 8 AM to Lijiang with an hour stop at .",,,,0,2,4,6,5,0,0,4,0,6,2,2026-04-08
Tsim Sha Tsui,China,,"We will be spending 2 full days in Hong Kong, and so on the first day you arrive, you can leave your bags at the hotel and go explore , a vibrant shopping district filled with casual eateries and eclectic local shops along neon-lit Nathan Road, as well as luxury malls lining nearby Canton Road. The area is also surrounded by many major tourist attractions, making it a great place to begin your journey in Hong Kong.",,,,5,4,6,5,5,8,7,9,6,5,1,2026-04-08
Tuojiang Stepping Stone,China,https://surl.amap.com/eRY8Hr2C2Gw,"Not far from Snow Bridge, you will find the , a unique crossing that connects the two sides of the river with two rows of independent square stone piers. True to its name, crossing the river requires stepping from one stone to the next, with the crystal-clear Tuojiang River flowing beneath your feet, making it both fun and scenic.",,,,7,7,2,10,6,6,1,8,1,7,1,2026-04-08
Victoria Harbour,China,,"Once evening rolls around, come back to  and watch the city lit up in dazzling lights as the sun sets behind the horizon. Hong Kong's skyline is legendary, and there’s no better place to enjoy it than here.",,,,9,4,0,9,4,5,2,9,4,5,1,2026-04-08
Victoria Peak,China,,"On your second day in Hong Kong, start the morning by heading up to  to enjoy the stunning view of the cityscape. You can take a taxi up instead of the tourist tram, and here’s why.",,,,5,5,10,5,5,5,5,5,5,5,1,2026-04-08
Victoria Peak's Lions Pavilion,China,,"Also, skip the Sky Terrace 428. You can easily enjoy the same views for free at , just a short walk from the tram station. The views are just as stunning, and it won’t cost you a thing! For a quieter experience, you can also hike along the Peak Trail to escape the crowds and take in the scenery in peace.",,,,4,3,4,9,8,0,0,9,2,6,1,2026-04-08
Visitor Center,China,https://surl.amap.com/zyzlJaN1sgtc,"One of the first experiences you will witness is the Welcome Wine-Drinking Ceremony, also called ""Twelve Rounds of Welcome Wine"", held at the . It begins around 10:30 AM in the front courtyard. I just so happened to arrive around that time and was able to see the Miao people performing music with traditional instruments and dances in their full attire.",,,,3,5,4,4,6,10,0,7,6,8,1,2026-04-08
Wanshou Wharf,China,https://surl.amap.com/kUT2MBb3eNi,"To go boating along the Tuojiang River, you can book your ticket here under ""Boat ticket."" You can choose a day cruise for 76 CNY or a night cruise for 138 CNY, and board from either the North Gate Wharf or the . The ride takes about 25 minutes. The day cruise runs from 8 AM to 5:50 PM, while the night cruise operates from 6:30 PM to 11 PM.",,,,0,2,2,6,7,1,0,6,9,10,1,2026-04-08
Welcome Pond,China,https://surl.amap.com/Ki29MGJ10e6I,"Right from the start, after hiking through a thick forested area, you will arrive at the , a collection of beautiful pools with crystal-clear water located around 3,230 meters above sea level. This gives you a glimpse of the stunning scenery to come as you continue hiking upward. There is plenty more to see along the way!",,,,4,6,4,10,9,0,0,8,0,6,1,2026-04-08
Wenshu Monastery,China,https://surl.amap.com/3GEY63U1hfQl,"is one of the oldest and most important Buddhist temples in the city, dating back more than 1,400 years to the Sui Dynasty (around 605–617). It has been destroyed and rebuilt in different styles throughout its history, but nowadays, the temple’s architecture is typical of classical Chinese Buddhist temples, with a sequence of halls aligned along a central axis, leading to the main Buddha hall and the sutra library.",,,,2,4,2,0,3,10,0,6,6,8,1,2026-04-08
West Kowloon Station,China,,"From Hong Kong, you can take a high-speed train from  to Guangzhou South Railway Station. It costs around 30 USD and takes a little over an hour. You can book the ticket in advance here.",,,,5,5,10,5,5,5,5,5,5,5,1,2026-04-08
Wulingyuan Bus Station,China,https://surl.amap.com/1V7hCT45bDW,"By Bus: Long-distance buses are another option, especially from nearby provinces and cities like Changsha, Fenghuang, and Chongqing. Buses typically arrive at Zhangjiajie Central Bus Station or , from where taxis or local buses can take you to your accommodation.",,,,0,1,4,0,2,1,1,1,3,8,1,2026-04-08
Xianggong Viewpoint,China,https://surl.amap.com/191xAdVrUaB4,"is one of the most iconic viewpoints along the Li River. From the top, you can see the river bend in a dramatic horseshoe shape, surrounded by countless karst peaks stretching into the distance, and it is one of my favorite viewpoints in Guilin.",,,,6,5,2,9,7,1,0,8,0,7,1,2026-04-08
Xijiang Miao Ethnic Museum,China,https://surl.amap.com/BBPx5THG8aP,"While you are exploring the lower part of the village, you might also want to go and check out , a small local museum located not too far from the Lusheng Field, one of the main squares in the village. The museum consists of several rooms spread out across 2 floors.",,,,3,5,2,3,3,10,0,6,3,8,1,2026-04-08
