place,country,google_maps_url,description,region,place_type,blog_source,romance,family,cost,nature,adventure,culture,food,relaxation,service,accessibility,description_count,last_updated
Rome,Italy,https://goo.gl/maps/vwnWS94mGmAN4NnAA,"As we continue our journey across Italy, we have finally arrived in the Eternal City of  but before we start exploring the city right away, I recommend you spend the first half of the day in  and visit the Vatican City, the smallest sovereign state in the world and is located entirely within the city of , surrounded by walls. Be sure to get there as early as 7:30 AM to avoid the long queue.

Once you are done with the Vatican City, on the same day, it is time to explore  proper. We start off right out of the gate of the Vatican City at Castel Sant'Angelo, a fortress, and mausoleum originally built as a tomb for the Roman Emperor Hadrian in the 2nd century AD before it was later used as a fortress, and prison by the Popes, hence why it is so close to the Vatican City.

Of course, you can't have a list of the best places to visit in Italy without mentioning , the capital city of Italy and home to some of the renowned landmarks in the world like the Colosseum, the Pantheon, Trevi Fountain, and so much more.",,,,4,5,6,0,5,10,2,6,8,8,1,2026-04-07
Saint Mark's Basilica,Italy,https://goo.gl/maps/ib22z4GAYhZL7omE6,"Another important landmark at St. Mark Square is , a grand cathedral that is considered to be one of the most important examples of Byzantine architecture in the world.

Not too far from St. Mark's Campanile, you will another important landmark of Venice, , a grand cathedral that is considered to be one of the most important examples of Byzantine architecture in the world.",,,,4,5,14,3,4,8,4,6,7,7,1,2026-04-07
San Pietro Caveoso,Italy,https://goo.gl/maps/YLNmP6WfgQHTEXgx5,"The church is open from 10 AM to 7 PM every day and the entrance fee is 4 EUR per person. You can also buy a combination ticket which will allow you to visit all 3 churches in the area (Chiesa di Santa Lucia alle Malve, Saint Mary of Idris (this one), and ), all for 8 EUR per person.

Located just north of the Church of Saint Mary of Idris, you will find , another important church in the city that dated all the way back to the 13th Century, known for its beautiful Baroque-style facade and the frescoes on the ceiling.",,,,2,4,6,0,1,10,0,5,2,8,1,2026-04-07
Sanctuary of Apollo,Italy,https://goo.gl/maps/phJyucJTvKDrrPqBA,"Not too far from the Pompeii Forum, you will also find the , the remains of an Apollo temple with iconic columns still left standing since it was constructed in the 6th Century BC.",,,,5,5,20,5,5,5,5,5,5,5,1,2026-04-07
Santa Maria dell'Ammiraglio,Italy,https://goo.gl/maps/rYPFxA7JMWzpV4GXA,"Next to the Church of San Cataldo, you will find , another impressive church in Palermo that is definitely worth going inside to see its incredible frescoes.",,,,5,5,20,5,5,5,5,5,5,5,1,2026-04-07
Sassi of Matera,Italy,https://goo.gl/maps/MmdAR5895M1FkKVA8,"Before we leave the Lower Town, be sure to spend some time and explore all the wonderful corners of the  as there are some little pockets of hidden gems here and there waiting for you to discover.",,,,5,5,20,5,5,5,5,5,5,5,1,2026-04-07
Scala dei Turchi,Italy,https://goo.gl/maps/NSkDYXuicp6T2emq6,"Last but not least, if you are staying overnight in Agrigento and are looking for a cool day trip to make, I highly recommend you go on a day trip and visit  or the Turkish Staircase, which is not really a staircase but a beautiful rock formation located on the coast near Agrigento.

On the next day, we are going to visit  or the Turkish Staircase, which in truth, is not really a staircase but a beautiful rock formation located on the coast near Agrigento where you can go swim and relax at the beach.",,,,2,4,4,10,9,5,0,6,0,6,1,2026-04-07
Scoglio di Monterosso,Italy,https://goo.gl/maps/qPpt4AGs9bdYRcAq8,"While you are in Monterosso, be sure to check out , a beautiful rock formation, and Statua del Gigante a beautiful giant stone statue carved out of the cliff nearby. You can also have a late lunch or spend the rest of the evening, enjoying the sunset in Monterosso.",,,,8,5,4,9,5,6,2,9,1,2,1,2026-04-07
Secada,Italy,https://goo.gl/maps/fMSimquMjtnaN9dJ9,"On your first full day in the Dolomites, we are going to visit the stunning  in the morning and Alpe di Siusi in the afternoon so be sure to get up as early as you can to catch the bus to Ortisei/Urtijëi, where the cable car stations to these places are located.

Last but not least, if you have a day to spare, you are going to want to spend it exploring the mountains here and see why the Dolomites are considered to be the most beautiful region in the world. The best places to see just that are  and Alpe di Siusi, beautiful mountain viewpoints that can easily be reached via cable cars from Ortisei/Urtijëi.",,,,2,4,6,10,10,3,1,8,4,7,1,2026-04-07
Seceda,Italy,https://goo.gl/maps/bkBk7pU8JmCSYH9H6,"is an iconic mountain peak in the Odle mountain range and it is one of the most well-known mountain peaks in the Dolomites. This jagged layered mountain peak is home to some of the most accessible hiking trails and incredible panoramic views in the area and it is one of the first places I highly you visit when you are in the Dolomites.

Even if you are not into hiking, there are still plenty of viewpoints you can visit that can be easily accessible via a cable car. , an iconic mountain peak in the Odle mountain range, one of the most well-known mountain peaks in the Dolomites, and Alpe di Siusi, a high-altitude plateau with a great view over the valley, are 2 of my favorite spots for this, so be sure to check it out.",,,,4,6,8,10,10,2,0,8,2,8,1,2026-04-07
Seceda Cable Car Station,Italy,https://goo.gl/maps/H65LpLA4R4vm5MWB9,"Once you arrive in Ortisei, you can then make your way up the escalator to the  where you can then buy a roundtrip ticket for 38 EUR, and it should take about 30 minutes until you reach Seceda.",,,,5,5,20,5,5,5,5,5,5,5,1,2026-04-07
Seilbahnen St.Ulrich Cable Car Station,Italy,https://goo.gl/maps/wz3m1aqcVSZJEKS9A,"After lunch, you can make your way to  located just across the main road on the other side of the valley, buy a roundtrip ticket to Alpe di Siusi for about 24.9 EUR, and off you go to our next destination.",,,,0,0,8,9,8,0,0,7,2,9,1,2026-04-07
Sforzesco Castle,Italy,https://goo.gl/maps/cyw5PrAuKsbuGRht5,"As you explore the city center, head north and you will find the incredible , a massive 15th-century castle complex built by the powerful Sforza family, who ruled Milan during the Renaissance. They also used to live at the Royal Palace, which is located not too far from here, at the time.",,,,3,5,4,0,5,10,1,6,6,10,1,2026-04-07
Siena,Italy,https://goo.gl/maps/Gmf5ViR67gSZZiMY7,"With a free day in Florence, you can choose to visit Pisa and see the iconic Leaning Tower of Pisa or , an incredibly beautiful medieval town full of houses with reddish brown roofs which is where the color ""Sienna"" got its name from.

For those of you who are not interested in Pisa, you can also go on a day trip from Florence and visit , one of the most beautiful medieval towns that will make you feel like you just traveled back in time as you walk through its crisscrossing streets.

is one of the most beautiful medieval towns with a long and fascinating history, dating back to the Middle Ages. The city is known for its medieval architecture and is home to a number of important landmarks and historical sites, including the Piazza del Campo, the city's main square and my favorite place out of all, the Palazzo Pubblico, or the city's town hall, and the Torre del Mangia, a tall tower that offers panoramic views of the city.",,,,5,5,8,3,5,10,2,7,5,6,1,2026-04-07
Sorrento,Italy,https://goo.gl/maps/oSDkkje9kzbwXRV37,"Since  is the most centrally located city in this itinerary, I highly recommend you base yourself out of here as you explore Amalfi Coast.

For the most central location, I highly recommend you stay in . It is centrally located and will allow you to travel along the Amalfi Coast as well as Pompeii and Capri quite easily.

There are several towns along the Amalfi Coast that are worth visiting, like , a tourist town that is the perfect place to base yourself as you explore the Amalfi Coast.",,,,5,5,20,5,5,5,5,5,5,5,1,2026-04-07
Sorrento Train Station,Italy,https://goo.gl/maps/yC8jvVmrvmm5Ny337,"From Sorrento to Pompeii, you just have to take the train from  and get off at Pompei Scavi Villa Dei Misteri, and you should be right at the entrance of the archeological site. The train ticket should cost around 2.5 EUR per person per trip and it should take no more than 20 minutes to get there.

From Sorrento (the Amalfi Coast) to Naples, you can take the same L1 train from  you took here, back to Naples. The ticket can only be bought from the train station, costs around 5 EUR, and takes about 1 hour to reach Naples.

From Sorrento to Bari, you are going to have to take the train to Naples first via the L1 train from . The ticket can only be bought from the train station, costs around 5 EUR, and takes about 1 hour to reach Naples.",,,,0,1,6,1,0,3,1,1,7,9,1,2026-04-07
Sorrento pier,Italy,https://goo.gl/maps/94ZXsjuR8pXLCU8U7,There are several ways you can visit Capri. One is to do it independently by taking a ferry from  to Capri which should cost around 22 EUR per person per trip and takes about 25 minutes. You can book the ferry ticket here.,,,,0,0,8,1,4,1,0,1,1,6,1,2026-04-07
South Tyrol Archeological Museum,Italy,https://goo.gl/maps/fwYs1CSDcRJZQrEz8,"The journey from Venice to Bolzano can be quite long but if you arrive in Bolzano early, be sure to check out some of the city's best attractions like Bolzano Cathedral, a beautiful Gothic church, hang out at Waltherplatz, a 19th Century plaza set against the Dolomites, or visit the .

, also known as the Ötzi Museum, is a museum dedicated to the ""Iceman"", a 5,300-year-old mummified corpse that was recently discovered in the region in 1991, thanks to global warming 🥲.

Spend your first day in Bolzano getting acquainted with your new surroundings. There are many notable landmarks you should visit while you are here such as Bolzano Cathedral, a beautiful Gothic church, hang out at Waltherplatz, a 19th Century plaza set against the Dolomites, or visit the .",,,,6,5,8,8,4,9,2,7,4,6,1,2026-04-07
Spanish Steps,Italy,https://goo.gl/maps/tY26vAXT84BhfMGz6,"Just north of the Trevi Fountain, you will find another popular landmark of Rome, the , a famous set of 138 steps that lead up to the Piazza di Spagna where you can get an incredible view of Rome.",,,,5,5,20,5,5,5,5,5,5,5,1,2026-04-07
Squero di San Trovaso,Italy,https://goo.gl/maps/TBK1DqHj2wxAu2ReA,"Not too far from Ponte dell'Accademia bridge, you will also find , a traditional Venetian boatyard where gondolas and other types of boats were built and repaired and the boatyard is still in use even today.",,,,3,6,4,8,8,9,2,7,7,8,1,2026-04-07
St. Charles Church,Italy,https://goo.gl/maps/P6jENyW9kfxr3fM79,"If you are looking for a great viewpoint over the old town of Noto, you can't go wrong with the Bell Tower of , an 18th Century church with a bell tower that dominates much of Noto's Old Town.",,,,5,5,20,5,5,5,5,5,5,5,1,2026-04-07
St. Mark's Campanile,Italy,https://goo.gl/maps/iKZoJw7juQFdfZ6B6,"While you are at the square, you might as well go and climb , a 98.6-meter-tall bell tower built in the 11th Century, offering one of the best views over Venice and its incredible Venetian lagoon.

For the best viewpoint in Venice, the reward goes to.. the observation deck atop , a 98.6-meter-tall bell tower built in the 11th Century, right in the heart of Venice, next to St. Mark Square.",,,,5,5,20,5,5,5,5,5,5,5,1,2026-04-07
St. Mark's Square,Italy,https://goo.gl/maps/sQSwJajV6moZdKoq5,"If you start your journey from Milan early, you should have some time to explore some of the highlights of Venice in the afternoon and evening like , a vast public in the heart of the city where most journeys in Venice begin.

is probably where you will want to start your journey in Venice. The square is located in the heart of the city and is surrounded by some of Venice's most important landmarks as well as museums which make for a great center point to begin our journey.

If you start your journey from Lake Como early, you should have some time to explore some of the highlights of Venice in the afternoon and evening like , a vast public in the heart of the city where most journeys in Venice begin. Or you can relax for the day and leave these places for the next day since you will have a full day in Venice.",,,,4,4,6,1,4,9,3,7,7,6,1,2026-04-07
St.Ulrich Cable Car Station,Italy,https://goo.gl/maps/wz3m1aqcVSZJEKS9A,"After lunch, you can make your way to  located just across the main road on the other side of the valley, buy a roundtrip ticket to Alpe di Siusi for about 24.9 EUR, and off you go to our next destination.

To get to Alpe Di Siusi, you will also have to take bus #350 from Bolzano to Ortisei/Urtijëi but instead of heading north to Secada cable car, you head south across the main road instead and take the cable car from the , buy a roundtrip ticket to Alpe di Siusi for about 24.9 EUR, and you will be there in no time.",,,,0,0,8,8,8,0,0,6,5,9,1,2026-04-07
Syracuse,Italy,https://goo.gl/maps/9iKQiyj4gNCTW2MK9,"Next up, we are visiting the beautiful coastal city of  with its charming old town, ancient Roman ruins, and picturesque coastline, there is no shortage of things to do and see in this Mediterranean gem.",,,,7,6,8,8,6,10,1,8,6,5,1,2026-04-07
Syracuse train station,Italy,https://goo.gl/maps/LBNAagtvLnyosVyMA,"To get from Syracuse to Catania, simply take the train from  which operates several times a day between 5 AM to 7:25 PM back to Catania. It should take about one hour, and cost around 11 EUR. You can book the train here.",,,,0,0,8,0,0,0,0,1,7,9,1,2026-04-07
Syracuse's bus station,Italy,https://goo.gl/maps/w5jaxT68B8TYAd366,"To get from Syracuse to Noto, all you have to do is catch a bus operated by Interbus from  and it will take you to Noto in less than 1 hour dropping you off near Noto's old town. The bus runs every hour and it should cost you around 9 EUR. You can book the ticket online here.",,,,0,0,8,0,0,1,0,0,6,10,1,2026-04-07
Targa Commemorativa Papa Giovanni Paolo II,Italy,https://goo.gl/maps/yDST3MePMif3GC8h9,"Be sure to go up a little further and check out , a commemorative plaque erected in honor of Pope John Paul II, who visited the Dolomites in 1988 and celebrated Mass at the Rifugio Croda da Lago, located at the base of the Tre Cime di Lavaredo peaks. It is also a good place to get away from the crowds that start to accumulate over the ridge.",,,,3,4,4,9,7,10,0,7,4,7,1,2026-04-07
Teatro Grande,Italy,https://goo.gl/maps/yPQc1nBeEDxS5toy6,", also known as the Great Theater of Pompeii, is one of the first large structures you will visit in Pompeii. This ancient Roman theater was built in the 2nd century BC and is believed to have had a capacity of more than 5,000 spectators. How they were able to build this 2,000+ years ago is beyond me.",,,,1,3,4,0,4,10,0,4,3,9,1,2026-04-07
Teatro Margherita,Italy,https://goo.gl/maps/g3zJ6EAMS6iBconz5,"Be sure to stroll around here for a bit and continue and make your way up north and check out , a beautiful art nouveau building that was once used as a cinema and a theater before it was converted to an exhibition space for a contemporary art exhibition.",,,,4,4,4,1,4,10,1,7,4,9,1,2026-04-07
Tempio di Giunone,Italy,https://goo.gl/maps/cEHCzn3Q4KcinKGZ6,"Other notable attractions in the park you should see are , an ancient Greek temple built in the 5th Century BC dedicated to the goddess Juno, Temple Of Heracles, an ancient Greek temple dedicated to Heracles, the Greek god of strength and courage, and the Temple of Zeus, a temple dedicated to Zeus, the king of the gods in Greek mythology.

Your first stop is , or Temple of Juno, an ancient Greek temple built in the 5th Century BC dedicated to the goddess Juno, the queen of the gods, and goddess of marriage and childbirth.",,,,4,4,12,7,6,8,2,6,2,4,1,2026-04-07
Temple of Concordia,Italy,https://goo.gl/maps/hpMzSMvQXqZVkadi7,"Here comes the highlight of the Valley of the Temple. Next up, we are visiting the , probably one of the most well-preserved Greek temples in the world and it is one of my favorite structures out of all.",,,,2,4,4,6,7,10,0,5,1,10,1,2026-04-07
Temple of Diana and Church of Saint Anne,Italy,https://goo.gl/maps/Smq2xAwUTLoc6oQP7,"While you are exploring Parco della Rocca di Cefalù, be sure to check out the , the 2 historical ruins located along the hiking trails inside the park.",,,,5,5,20,5,5,5,5,5,5,5,1,2026-04-07
Temple of Dioscuri,Italy,https://goo.gl/maps/BkrfP4tBFgJo8mgT6,"As we continue toward the western side of the valley, you will find the , another ancient Greek Temple built in the 5th century BCE and dedicated to the Dioscuri, the twin brothers Castor and Pollux in Greek mythology.",,,,2,5,4,8,8,10,2,7,5,8,1,2026-04-07
Temple of Heracles,Italy,https://goo.gl/maps/waqx5Pk9qd9BWwB67,"Continue west and you will find the , an ancient Greek temple built in the 5th century BCE and dedicated to Heracles, the Greek god of strength and courage.",,,,5,5,20,5,5,5,5,5,5,5,1,2026-04-07
Temple of Olympian Zeus,Italy,https://goo.gl/maps/cKWPWj3hi6cjw4Xa9,"Next to the altar, you will find the , another ancient Greek temple built 5th century BCE and dedicated to Zeus, the king of the gods in Greek mythology.",,,,5,5,20,5,5,5,5,5,5,5,1,2026-04-07
Terrazza Belvedere del Palatino,Italy,https://goo.gl/maps/CB6qV8BJCKbMFSoS6,"For the best viewpoint in Palatine Hill, I highly recommend you check out , a beautiful terrace overlooking the Roman Forum where you will be able to get a sweeping view from the Colosseum all the way to the Altar of the Fatherland.",,,,6,5,4,9,7,10,0,8,1,7,1,2026-04-07
The Church of San Cataldo,Italy,https://goo.gl/maps/rYPFxA7JMWzpV4GXA,"is another incredible church you should visit while you are in Palermo. The church is of Norman origin and it is known for its distinctive red domes and simple, yet elegant, architectural style the Normans are known for.

After you are done with the food, you can then spend your day exploring all the beautiful architecture in Palermo starting with  and Santa Maria dell'Ammiraglio, both are incredible little church of Norman origins that showcases the diverse architectural style that blends the Arabs, Normans, and Byzantine influences together perfectly.

You will also find some of the most impressive and unique pieces of architecture that highlight the incredible diversity of Sicily incredibly well, like , a stunning Norman Chuch Palermo Cathedral, a massive 12th Century cathedral, the Norman Palace, a 9th-century palace, home to the famous Cappella Palatina.",,,,3,3,6,0,1,9,1,4,4,6,1,2026-04-07
The Leonardo da Vinci's Museum of Science and Technology,Italy,https://goo.gl/maps/2Dp6MHq9k9bzhWiR7,"For the most fun museums in Milan, I have to give it to , a museum dedicated to all the works and inventions, both the awesome and the weird, of the famous artist, scientist, and inventor Leonardo da Vinci",,,,0,3,4,2,6,10,0,1,0,1,1,2026-04-07
The Pantheon,Italy,https://goo.gl/maps/LJaycCanVjQ7b45m8,"As you continue to walk east from Piazza Navona, you will find one of the oldest landmarks in the city, , one of the greatest architectural masterpieces of ancient Rome that have stood the test of time for more than 2000 years.",,,,3,4,4,6,7,10,2,7,2,7,1,2026-04-07
The Roman Columns of San Lorenzo,Italy,https://goo.gl/maps/2FiQibgZgT6dmMvC9,"Other notable attractions you should visit in Milan are , a group of 2nd Century ancient Roman columns, Basilica Di Sant'Ambrogio, one of the oldest structures you can see in Milan, Sforzesco Castle, a massive 15th Century castle complex full of museums and beautiful parks and gardens, and so much more.",,,,4,6,4,7,4,10,0,7,2,7,1,2026-04-07
Toblach,Italy,https://goo.gl/maps/xAmVjShZEPxKg1Ch9,"As we are heading east, we are going to use  as our base of exploration. Unlike, Bolzano,  is not as big and as lively but it is still quite beautiful and offers a great base to explore other parts of the Dolomites such as Tre Cime and Pragser Wildsee.",,,,6,6,8,10,8,5,2,8,4,7,1,2026-04-07
Toblach Train Station,Italy,https://goo.gl/maps/VHXWz4PKTidb2VHK6,"The shuttle service leaves from  so be sure to be there on time. The journey should take about 45 minutes before you arrive at the Tre Cime trailhead. I took the 7:43 AM shuttle and I was there 8:34 AM.

The hike is also easily accessible with a shuttle service running between Toblach/Dobbiaco town and the Tre Cime trailhead. The shuttle service leaves from  so be sure to be there on time. The journey should take about 45 minutes before you arrive at the Tre Cime trailhead. Definitely one of the best places to visit in the Dolomites.

The shuttle service leaves from  so be sure to be there on time. The journey should take about 45 minutes before you arrive at the Tre Cime trailhead.",,,,3,3,12,7,8,3,2,6,6,7,1,2026-04-07
Toblach/Dobbiaco,Italy,https://goo.gl/maps/EWYwwF3vHctaET6V9,"To get to Pragser Wildsee, you are going to have to base yourself out of , a mountain town located on the eastern side of the Dolomites and a perfect base to see the lake as well as Tre Cime di Lavaredo I recommended earlier.",,,,4,5,8,10,8,7,3,8,8,7,1,2026-04-07
Torre Castello San Vigilio,Italy,https://goo.gl/maps/UKz4U9A9TDDSguLt6,"After you have taken the funicular up, you can stroll around the area and make your way to , a castle ruin that sits on top of a hill overlooking the city of Bergamo, which is only a few minutes' walk away from where you got off the funicular.",,,,5,5,8,9,8,10,0,8,1,7,1,2026-04-07
Torre dello Ziro,Italy,https://goo.gl/maps/YvnDsA4jT8uFzwrt8,"You can also hike up to  for an incredible view over Amalfi and the coastline or if you are not much of a climber, you can just walk up to Belvedere cimitero monumentale which should give you a pretty nice view of Amalfi from above as well.",,,,4,5,4,9,9,5,0,8,2,6,1,2026-04-07
Tourist Information,Italy,https://goo.gl/maps/hW23XGKmrFxkhe1g9,"Also, be sure to visit the  in town and grab your Mobilcard, a tourist card that will allow you to take as many buses and trains as you wish for free for a period of time. Since we will be spending 2 days in the Dolomites, I highly recommend you get the 3-day one which should cost about 23 EUR per person.",,,,0,1,8,7,8,4,0,5,1,2,1,2026-04-07
Tre Cime,Italy,https://goo.gl/maps/Gz1B82GuaQD6ruZCA,"is one of the best hikes you can do in the Dolomites and the trail leads to the  di Lavaredo, a group of three distinctive peaks that rise up to over 2,800 meters (9,200 feet) above the surrounding landscape.

is hands down, one of the best places to visit in the Dolomites and the best hike you can do in the region. This 8.2 KM hiking trail will lead you to the  di Lavaredo, a group of three distinctive peaks that rise up to over 2,800 meters (9,200 feet) above the surrounding landscape.",,,,4,6,4,10,10,3,0,8,0,7,1,2026-04-07
Tremezzo bus stop,Italy,https://goo.gl/maps/EXJRh1nSrtfrbrBa8,"Once you are done with the villa, catch the same bus #C10 from the  in front of the villa to go to our next destination, Villa del Balbianello. You should be done at Villa Carlotta by 2:30 PM - 3 PM.",,,,5,5,20,5,5,5,5,5,5,5,1,2026-04-07
Trevi Fountain,Italy,https://goo.gl/maps/qaRfkrYJZp9wzBHM7,"And of course, you can't travel to Rome without checking out the famous , a beautiful Baroque-style fountain known for its legend that whoever threw a coin into the fountain, will surely return to Rome.

And of course, you can't travel to Rome without checking out the famous , a beautiful Baroque-style fountain from the 18th Century featuring beautiful and intricate sculptures and designs on a scale you have never seen before.",,,,4,2,0,2,0,10,0,4,0,2,1,2026-04-07
Trinità dei Monti,Italy,https://goo.gl/maps/yNXot8sxvLjo8gEk6,Climb all the way up to the french church of  located at the top of the Spanish Steps and check out the view before we continue our exploration around Pincio Hill.,,,,5,5,20,5,5,5,5,5,5,5,1,2026-04-07
Trulli Panoramic View,Italy,https://goo.gl/maps/UJ3CrT7SkZSn624c6,"One of the first places I recommend you visit in Alberobello is the  viewpoint, an observation deck located just north of Monti District (Rione Monti) where all the beautiful unique-looking truillis are located.",,,,4,4,4,10,8,7,0,7,0,8,1,2026-04-07
Trullo Siamese,Italy,https://goo.gl/maps/RWkhtR3XKnkgZd3y6,"is another notable attraction in Monti you shouldn't miss.  is like any other Trulli, characterized by its conical roof made of stone slabs attached to a rectangular building.",,,,5,5,20,5,5,5,5,5,5,5,1,2026-04-07
Trullo Sovrano,Italy,https://goo.gl/maps/Z15UFGRn9Zh2mEuD9,"If you are interested to learn more about the history of Alberobello and how these Trulli houses came to be, I highly recommend you check out , a heritage museum housed inside an 18th Century Trulli structure.",,,,2,3,4,0,2,10,1,5,8,10,1,2026-04-07
Two Towers,Italy,https://goo.gl/maps/jaZERo1PhUJUh6X86,"Everybody knows about the Leaning Tower of Pisa, but I bet that not many know about Bologna's crooked , which are among the most iconic landmarks in the city. In the past, the people here began building these tall watchtowers, possibly as a display of wealth, and there were so many of them at one point that the city earned the nickname 'the city of medieval towers.",,,,2,4,4,2,7,10,1,6,7,8,1,2026-04-07
