place,country,google_maps_url,description,region,place_type,blog_source,romance,family,cost,nature,adventure,culture,food,relaxation,service,accessibility,description_count,last_updated
Abbazia di San Miniato al Monte,Italy,https://goo.gl/maps/PmeFh2AfrHCfkT47A,"If you are looking to avoid the crowds, you can also go a little further uphill and check out , a beautiful Benedictine abbey founded in the 10th Century located on a hill offering another great view of Florence",,,,4,4,4,10,7,9,0,7,0,3,1,2026-04-07
Accademia Gallery,Italy,https://goo.gl/maps/Npk8FoNk1GwudkAu9,"Another incredible art gallery you shouldn't miss is , an art museum best known for its collection of Renaissance art, which includes some of the most famous and iconic works in the world, such as Michelangelo's ""David"" sculpture.",,,,0,1,4,0,0,10,0,0,0,1,1,2026-04-07
Adolf-Munkel-Weg,Italy,https://goo.gl/maps/agbcuq4oujnt3k6R7,"On our second day in the Dolomites, we are going to have our first proper hiking experience by hiking the  hiking trail, a 10 kilometers (6 miles) long trail that takes about 4-5 hours to complete.",,,,5,5,20,5,5,5,5,5,5,5,1,2026-04-07
Agrigento,Italy,https://goo.gl/maps/EpuRejiY8ewzqyKP9,"After 2 full days in Palermo, it is time to move on to our next destination, , a nice quiet city near the southern coast of Sicily, home to the Valley of the Temples, some of the most well-preserved Greek ruins in the world and one of the highlights of visiting Sicily.",,,,3,4,4,7,7,10,1,7,5,6,1,2026-04-07
Alberobello,Italy,https://goo.gl/maps/rLAUgQeXaphdWNXM8,"Another great day trip you can make from Bari is to visit , another beautiful city known for its unique trulli, a small, conical-roofed home made of stone. The trulli were originally used as temporary shelters for farmers but now it has become the identity of  and one of the most popular tourist attractions in Puglia.",,,,2,4,4,6,4,10,0,6,1,5,1,2026-04-07
Alberobello Train Station,Italy,https://goo.gl/maps/sMh8zkYs2d9KQsbE9,"Once you arrive at , you will then have to walk about 15 minutes to reach the old town area and you will be right in the middle of all the actions.

Once you arrive at , you will then have to walk about 15 minutes to reach the old town area and you will be right in the middle of all the actions. Make sure you remember where the bus drops you off as you will have to get back here to catch the bus back to Bari.",,,,2,2,14,2,3,4,2,3,4,6,1,2026-04-07
Altar of the Fatherland,Italy,https://goo.gl/maps/BMgyHmmtkz4JwxZ5A,"As we continue our journey north, you will stumble upon another important landmark of Rome, the , a massive marble monument dedicated to the first king of a unified Italy to commemorate the first anniversary of the king's death in 1900.",,,,1,3,4,0,4,10,0,4,3,7,1,2026-04-07
Altar of the Temple of Zeus,Italy,https://goo.gl/maps/eoaMBFEFGBaoJo4H9,"Right off the bridge, on your right, you will find curious-looking lines of rectangular rocks laid on the ground across several meters. This is the  where they sacrifice animals during festivals and ceremonies.",,,,0,3,0,7,8,8,0,3,0,2,1,2026-04-07
Amadé Restaurant,Italy,https://goo.gl/maps/QqrvYdDAxRoH9ZNMA,"is a little family-run restaurant located on the corner of a quiet street just outside of the city center. It is popular among the locals, has a small garden area for seatings, and very friendly staff, a perfect combination for a great restaurant in Italy.",,,,7,7,12,5,1,9,7,10,9,6,1,2026-04-07
Amalfi Coast,Italy,https://maps.app.goo.gl/4hBkCXZgXiQ8PeAE9,"is the crown jewel of Central Italy when it comes to offering unmatched sceneries filled with charming colorful towns, beautiful mountains, and breathtaking beaches. It is like the Cinque Terre of Central Italy and a place that you should definitely not miss as you travel across Italy.",,,,10,7,4,10,7,7,4,9,8,4,1,2026-04-07
Amalfi Town,Italy,https://goo.gl/maps/fcRhJ8yy1rifX4oo6,"From Positano, it should take around an hour by bus before you arrive at , another charming town known for its stunning coastline, historical architecture, and charming Mediterranean atmosphere, that you should definitely not miss.

is also another charming town known for its stunning coastline, historical architecture, and charming Mediterranean atmosphere, which you should definitely not miss.",,,,6,6,14,8,4,7,3,7,4,6,1,2026-04-07
Amphitheater of Pompeii,Italy,https://goo.gl/maps/BvsrXQhyPy5CVCz87,"One of the largest structures in Pompeii, the  located on the eastern part of the park, was built in the 2nd Century BC and it is considered to be the oldest and best-preserved amphitheaters in the Roman world.",,,,2,4,4,7,7,9,0,7,3,9,1,2026-04-07
Ara Coeli/P.Za Venezia bus stop,Italy,https://goo.gl/maps/b3bt8w4gq24n2yvc8,"Once you are done at the Altar of the Fatherland, you can then take bus #51 or #118 to  and walk a little to get to the Baths of Caracalla, an incredibly well-preserved public bath complex and one of my favorite ruins in Rome, which I prefer even more so than the Roman Forum and the Colosseum themselves.",,,,2,4,4,0,4,9,0,5,0,8,1,2026-04-07
Archimedes & Leonardo da Vinci Museum,Italy,https://goo.gl/maps/G9RMv2T5eqh8cCyv6,"As you explore the island of Ortigia, you will stumble upon the , a museum housing a collection of models of inventions created by two of history's most brilliant minds, Archimedes and Leonardo da Vinci.",,,,3,6,4,0,5,10,1,6,8,9,1,2026-04-07
Arco della Pace,Italy,https://goo.gl/maps/DKNhwL3jyeWrZqL2A,"As you explore Sforzesco Castle, do not forget to make your way to  through the beautiful green space of Sempione Park. , or Arch of Peace, is basically like the Arc de Triomphe of Paris but for Milan.",,,,5,5,4,8,4,9,0,8,4,8,1,2026-04-07
Arethusa Spring,Italy,https://goo.gl/maps/GRRkMvEcZMDJrFCe9,"is another cool place to visit and one that is probably the most unique attraction you will see in Syracuse. This natural spring is located on the southwestern side of the island and you can stroll around its shaded green space and escape the bustling city above.

is probably the most unique attraction you will see in Syracuse. This natural spring is located right in the middle of the street on the southwestern side of the island and you can stroll around its shaded green space and escape the bustling city above.",,,,6,6,6,10,6,0,0,9,0,7,1,2026-04-07
Bari Bus Stop,Italy,https://goo.gl/maps/BQhqfFtUvn7TAwA86,"If you are visiting Alberobello from Bari, the closest big city and a travel hub in Southern Italy, you can catch the 8 AM bus leaving from  just across from Bari Train Station and you should arrive in Alberobello around 9 and cost around 6 EUR. You can book the bus ticket from here.

From Bari, you can either use it as a base and visit Alberobello as a day trip or you can spend overnight in Alberobello. To get from Bari to Alberobello, you will have to catch the bus from  just across from Bari Train Station and it should take about 1 hour and cost around 6 EUR. You can book the bus ticket from here.",,,,0,0,8,0,0,0,0,0,5,10,1,2026-04-07
Bari Bus Stop at Largo Sorrentino,Italy,https://goo.gl/maps/BQhqfFtUvn7TAwA86,"To get from Bari to Alberobello, there are a handful of direct buses from 8 AM to 7:30 PM every day running between the 2 cities. The bus leaves from  just across from Bari Train Station and it should take about 1 hour and costs around 6 EUR. You can book the bus ticket from here.",,,,0,1,8,0,0,1,0,1,8,10,1,2026-04-07
Bari Bus Stop in front of DEA Cafe,Italy,https://goo.gl/maps/JhdFUmKULZ1baVe96,"Definitely one of the best things to do in Bari. To get from Bari to Matera, all you have to do is catch a bus from  which will take you to Matera in about 1 hour and cost around 10 EUR. You should be able to catch the 7:30 AM bus from there. You can book the bus from here.

To get from Bari to Matera, all you have to do is catch a bus operated by Italbus from  which will take you to Matera in about 1 hour and cost around 10 EUR. The bus stop is located here which is pretty far and takes about 30 minutes to get to Matera old town.",,,,0,0,10,0,0,2,0,1,4,10,1,2026-04-07
Basilica Cattedrale Metropolitana Primaziale San Sabino,Italy,https://goo.gl/maps/Np43hNMUYHGVSAn47,"is another cathedral you should check out while you explore Bari's Old Town. It stands right at the center of the Old Town's Square that connects directly to the new town area, so it would be impossible for you to miss it.

is another cathedral you should check out while you explore Bari's Old Town. The place is renowned for its beautiful facade, old-style stone interiors, and well-preserved wooden ceilings and to stands right at the center of the Old Town's Square, so it would be impossible for you to miss it.",,,,4,4,2,0,1,10,0,5,1,8,1,2026-04-07
Basilica Cattedrale di Matera,Italy,https://goo.gl/maps/piWwESDAcHoSiaD88,"is one of the most prominent cathedrals in Matera and you should be able to see its iconic bell tower, hovering over you throughout the town as you explore the Sassi.",,,,5,5,20,5,5,5,5,5,5,5,1,2026-04-07
Basilica San Nicola,Italy,https://goo.gl/maps/1Tf2LfnvHcptSzma9,"One of the most sacred cathedrals in Bari and one that attracts Eastern Europe Roman Catholic pilgrims since it was built in the 11th Century is , a place you shouldn't miss in Bari.

As you make your way to Bari's Old Town, right at the heart of it, you will find , one of the most sacred cathedrals in Bari and one that attracts Roman Catholic pilgrims for centuries since it was built in the 11th Century.",,,,4,5,12,2,4,8,4,6,7,8,1,2026-04-07
Basilica di San Giovanni in Laterano,Italy,https://goo.gl/maps/YCVpjQXGUKfaEMrH9,"From the baths complex, you can either walk for around 1.5 km or take bus #81 to get to , the mother church of all the churches in the world, and one of the 4 major basilicas to visit in Rome.",,,,5,5,20,5,5,5,5,5,5,5,1,2026-04-07
Basilica di San Lorenzo,Italy,https://goo.gl/maps/VUkkJKNpZjcKYLGdA,"Other notable attractions in Florence you shouldn't miss are , one of the first churches built in the city, Palazzo Vecchio, an iconic town hall considered one of the city's most famous landmarks, Ponte Vecchio, another historic landmark of the city, famous for its picturesque appearance, and Pitti Palace, the original residence of the Medici family.",,,,5,6,8,0,3,10,2,7,9,9,1,2026-04-07
Basilica di Santa Maria Maggiore,Italy,https://goo.gl/maps/a2LnKtxRmDAFDN1C7,"Bergamo is home to many historical and cultural sites all spread out across the Upper and Lower Towns. The entire Upper Town is a UNESCO World Heritage Site located inside a fortress on top of a hill overlooking Bergamo city and is home to many medieval and Renaissance buildings, including the  and the Cappella Colleoni.

While you are in the Upper Town, make sure you check out , Cappella Colleoni, Campanone, and Palazzo della Ragione.",,,,5,5,16,4,6,8,4,6,7,6,1,2026-04-07
Basilica di Santa Maria della Salute,Italy,https://goo.gl/maps/AspFAHfTCX37FXWw5,"Towering most of the low-rise buildings of Venice, you will find , a 14th Century basilica considered to be the finest example of Baroque architecture in Venice.",,,,5,5,20,5,5,5,5,5,5,5,1,2026-04-07
Basilica of Saints Cosmas and Damian,Italy,https://goo.gl/maps/jCf7JH166zwazXVi7,"Not too far from Trullo Sovrano, you will also find the , one of the most iconic landmarks in Alberobello and you can see its double bell towers from miles away across the city.",,,,5,5,20,5,5,5,5,5,5,5,1,2026-04-07
Basilica of St. Alexander in Column,Italy,https://goo.gl/maps/GJ3pgQTKtrByWbzK7,"The Lower Town is also full of interesting architecture and historical sites as well, like the  and Chiesa dei Santi Bartolomeo e Stefano, so be sure to check those out.",,,,5,5,20,5,5,5,5,5,5,5,1,2026-04-07
Bastione di Capo Marchiafava,Italy,https://goo.gl/maps/hHk6Y3ADqmMQ5aZFA,"Other notable attractions you should visit while you are in Cefalu are , a nice ocean viewpoint, Porta Pescara (Porta Marina), a concrete pier great for jumping in the water and relaxing by a sandy strip of beach nearby, and Lavatoio Medievale Fiume Cefalino, a 16th Century laundry house with laundry house, dating to 1514, with original stone wash basins &and cast-iron spouts.

is a fortification located on the northern tip of Cefalu at offers stunning views of the town and the surrounding coastline and is a great place to visit as you explore Cefalu's Old Town.

Other notable attractions you should visit while you are in Cefalu are , a nice ocean viewpoint, Osterio Magno, a historic fortified palace considered to be one of the town's most important historical landmarks, and Lavatoio Medievale Fiume Cefalino, a 16th Century laundry house with laundry house, dating to 1514, with original stone wash basins and cast-iron spouts.",,,,6,7,8,8,4,8,2,6,2,5,1,2026-04-07
Bellagio,Italy,https://goo.gl/maps/tZ5LLN2ZkQKbgTLD7,"or as it is sometimes referred to as the pearl of Lake Como is another cute charming little town located right at the center on a peninsula that protruded into the lake, essentially creating the lake's iconic inverted y shape.

, or as it is sometimes referred to as the pearl of Lake Como, is another cute charming little town known for its picture-perfect backdrop of the Alps as well as its colorful narrow streets, crisscrossing up the hillside, surrounded by stunning architecture, cafes, and restaurants.

The next day, you can take the ferry early in the morning and explore , or as it is sometimes referred as the pearl of Lake Como.  is another cute charming little town located right at the center on a peninsula that protruded into the lake, essentially creating the lake's iconic inverted y shape.",,,,9,6,6,10,5,8,6,9,7,3,1,2026-04-07
Belvedere Piazzetta Pascoli,Italy,https://goo.gl/maps/aZ2b96j78P6eHdt68,"In the Upper Town, you can check out , the best viewpoint over the Lower Town, Basilica Cattedrale di Matera, a monumental 12th Century cathedral that dominates Matera's skyline, and Palombaro lungo, a preserved cistern carved from the rock beneath the main plaza of Matera.",,,,4,6,4,10,7,10,0,6,0,9,1,2026-04-07
Belvedere dell'Alpe di Siusi,Italy,https://goo.gl/maps/C4Ptsq3sW2YahMff6,"With a short hike, you can get to , a breathtaking viewpoint located at an altitude of about 2,200 meters (7,200 feet) in the middle of the valley and offers an iconic view of Alpe di Siusi and its golden rolling hills.",,,,6,6,4,10,8,3,0,8,0,6,1,2026-04-07
Belvedere di Piazza Giovanni Pascoli,Italy,https://goo.gl/maps/qJZtsYAx3L9WfjNN6,"One of the first things I highly recommend you do is to visit , a terrace located in the Upper Town of Matera that offers an incredible view over the iconic Matera's cave cityscape.",,,,5,5,20,5,5,5,5,5,5,5,1,2026-04-07
Bergamo,Italy,https://goo.gl/maps/XxivHTFAeGc9Gb7W8,"On our third day, we can go on another day trip and visit , a beautiful city steeped in history and only an hour's train ride away from Milan, so you do not have to start as early as the day before. There are some truly incredible sights and attractions to be seen here and definitely worth a visit if you want a little change in scenery.

By Tours: If you prefer not to deal with the logistics, organized tours are available for getting around and for day trips to places like Lake Como and .

Known for its charming old Upper Town located on top of a hill overlooking the city, surrounded by ancient walls, and its modern and lively lower town,  is a charming city and a perfect destination for a day trip from Milan for anyone looking for a unique blend of history and culture.",,,,5,5,10,8,6,8,3,7,4,5,1,2026-04-07
Bologna,Italy,https://maps.app.goo.gl/fyRQKs9vVLYRKK6F7,"is probably better known for its delicious pasta dish than for the city the dish is named after, but this beautiful city in the northern part of Italy also offers a wealth of historical and cultural sights for tourists looking to venture away from the usual tourist routes, such as Milan and Venice.",,,,5,4,8,6,3,10,9,8,6,2,1,2026-04-07
Bolzano,Italy,https://goo.gl/maps/SUETUfnZ8cyHgopE7,"Our journey begins in , a gateway to the Dolomites and one of the best cities to base yourself in while you explore this beautiful region. It is also a great place to experience the rich cultural heritage of the region, with a mix of Italian and German influences you won't find anywhere else in Italy.

And that is it for your time in Toblach and the Dolomites. To get out of the Dolomites, you are going to have to make your way back to  and from there you can take the train or a bus to the rest of Italy or head over to Innsbruck to explore the Austrian Alps next.

Last but not least, you have to check out  while you are in the Dolomites. The city is considered to be a gateway to the Dolomite and is one of the best cities to base yourself in while you explore this beautiful region.",,,,4,3,6,7,6,4,3,6,6,7,1,2026-04-07
Bolzano Bus Station,Italy,https://goo.gl/maps/C9qKnxnUGukcMxbU7,"To get from Bolzano to Ortisei, you will have to go to  and catch bus #350 to Ortisei. The journey should take about an hour and you can use the Mobilcard you got yesterday, tap on the card reader machine, and off you go.

Seceda is easily reachable by public transportation from Bolzano, one of the biggest cities in the region. All you have to do is catch bus #350 from  and get off at Ortisei/Urtijëi, a small mountain town where the cable car to Seceda is located.

Getting here is also extremely easy as the lake is located right by the main road around the Dolomites. All you have to do is go to , catch bus #180, drop off at Karersee bus stop and you will be right at the lake in less than an hour.",,,,2,3,8,6,6,2,1,5,6,8,1,2026-04-07
Bolzano Cathedral,Italy,https://goo.gl/maps/neoiG9TEmBG8xzrT9,"The journey from Venice to Bolzano can be quite long but if you arrive in Bolzano early, be sure to check out some of the city's best attractions like , a beautiful Gothic church, hang out at Waltherplatz, a 19th Century plaza set against the Dolomites, or visit the South Tyrol Archeological Museum.

You can spend a day exploring the city and all it has to offer before you embark on the Adolf-Munkel-Weg hike the next day. Attractions I highly recommend are , a beautiful Gothic church, hang out at Waltherplatz, a 19th Century plaza set against the Dolomites, or visit the South Tyrol Archeological Museum to learn more about Ötzi, the ""Ice Man"".

Spend your first day in Bolzano getting acquainted with your new surroundings. There are many notable landmarks you should visit while you are here such as , a beautiful Gothic church, hang out at Waltherplatz, a 19th Century plaza set against the Dolomites, or visit the South Tyrol Archeological Museum.",,,,5,5,4,8,5,10,0,7,2,5,1,2026-04-07
Bolzano Train Station,Italy,https://goo.gl/maps/gSz6NZyZUUF4KHi28,"From Venice to Bolzano, there are a handful of trains you can take from Venice Train Station to  from 5:40 AM to 8:10 PM every day with a single transit in Verona.

From Bolzano to Florence, you can also catch a train from  to Florence Train Station between 5:00 AM and 5:10 PM every day with a direct train taking around 3 hours and costing between 46 - 60 EUR.

The next day, I highly recommend you wake up as early as you can and catch a train at 8 AM from  to Brixen. From Brixen Train Station, you can catch bus #330 from the bus station right in front of the station and it will take you all the way to Adolf-Munkel-Weg trailhead in one hour.",,,,2,2,12,5,5,3,2,4,4,7,1,2026-04-07
Bolzano/Bozen,Italy,https://goo.gl/maps/wvyqEvMaWdZQRff36,"After Venice, we are entering one of my favorite regions in Italy, the Dolomites, home to some of the finest mountain peaks in the world and there is no better place to base yourself in than , a charming city located right in the heart of the Italian Alps.

is a charming city located in the heart of the Italian Alps which makes it a great base for those who are looking to explore the incredible mountainous region of the Dolomites, one of the most beautiful places in the world.",,,,6,6,4,10,8,8,6,8,9,2,1,2026-04-07
Bridge of Sighs,Italy,https://goo.gl/maps/3Xe9j5x5bdYUqWFv7,"There are also many bridges in Venice that are worth visiting like the , a famous covered bridge connecting the palace to the New Prison (Prigioni Nuove) across the Rio di Palazzo, which shows what the justice system of Venice was like back then.

Located on the eastern side of the palace, you will find the , a famous covered bridge connecting the palace to the New Prison (Prigioni Nuove) across the Rio di Palazzo, which shows what the justice system of Venice was like back then.",,,,4,5,4,8,8,10,0,8,2,6,1,2026-04-07
Brixen,Italy,https://goo.gl/maps/qk87iq427vjf1EXWA,"Since you will be spending the entire day hiking, I highly recommend you pack your lunch in Bolzano the day before and start as early as you can. Go to Bolzano Bus Station and catch the train to , a beautiful small mountain with a German heritage we will be exploring in the evening.

There are many beautiful places to visit in the Dolomites, spread across the region, such as the gateway city of Bolzano, the quiet German town of , and the laid-back town of Toblach, which is often used by hikers as their base while exploring all the hiking trails in the region.",,,,3,4,6,10,8,6,2,8,4,5,1,2026-04-07
Brixen / Bressanone,Italy,https://goo.gl/maps/qk87iq427vjf1EXWA,"After all the mountain views, let's change it up a little and visit a beautiful mountain village.  is a small little mountain town with a huge German influence that almost felt like you are in Austria than Italy. It is the fifth-largest town in South Tyrol and is located in the Isarco Valley, at the foot of the Plose mountain range.",,,,5,6,12,10,8,9,4,9,8,7,1,2026-04-07
Brixen Cathedral,Italy,https://goo.gl/maps/ADiyyH1X9ftaxDx59,"The town is home to a number of cultural landmarks, including the , a Romanesque cathedral dating back to the 11th century, and the Diocesan Museum, which houses a collection of art and religious artifacts.",,,,3,5,8,0,2,10,1,7,8,9,1,2026-04-07
Cadini di Misurina,Italy,https://goo.gl/maps/MM74JHX7mbZjYt9a6,are a group of peaks located in the Dolomites mountain range in the northeastern part of the area and it got its name from the Misurina town nearby.,,,,5,5,20,5,5,5,5,5,5,5,1,2026-04-07
Cafalu Castle,Italy,https://goo.gl/maps/epL3roQHro3pZDt9A,"Be sure to hike all the way up to  for an even more incredible view over the city and its coastline. The hike is tough, especially in the summer months but the view is definitely worth every single drop of sweat.",,,,4,4,4,10,10,2,0,8,0,4,1,2026-04-07
Campidoglio,Italy,https://goo.gl/maps/oDkAwX5q6XomnwcbA,"After you are done with the Roman Forum, continue walking the path towards the northern exit which is right by our next destination,  or Capitoline Hill, one of the other Seven Hills of Rome, home to some of the oldest museums in the city.",,,,2,4,4,0,3,10,2,5,4,8,1,2026-04-07
Capitoline Museums,Italy,https://goo.gl/maps/t5EKcfhBEDLeKKPv9,"Here you will find an impressive Renaissance square, the Piazza del Campidoglio, designed by Michelangelo himself way back in the 16th century, and the , one of the oldest public museums in the world that house a vast collection of art and artifacts from ancient Rome. You can check the museum out too if you are interested in history and art.",,,,3,5,8,0,3,10,1,6,8,10,1,2026-04-07
Cappella degli Alpini,Italy,https://goo.gl/maps/LuTLK2PtaUqQT8Je9,"Along the way, you will pass by several interesting landmarks and rest stops, including , Rifugio Lavaredo, and Dreizinnenhütte where you can rest, fill up your water, or even have lunch.

From Rifugio Auronzo, the trail is mostly flat and it skirted around the foothill of Tre Cime. It is a pretty relaxing walk with a nice cool stop at , a beautiful chapel set against the striking jagged peaks of the Dolomites.",,,,6,6,14,8,6,6,2,7,2,5,1,2026-04-07
Capri,Italy,https://goo.gl/maps/vpdiJ5wdZAZgUeep7,"On our 7th day of this itinerary, we are going to visit , a small island just off the coast of Sorrento, best known for its picturesque landscapes, and the Blue Grotto, a sea cave that is illuminated by an underwater light, creating a mesmerizing blue hue, and spend the rest of the day relaxing, absorbing the beautiful sceneries, and swim to your heart's content before we head back home.

Last but not least, you can spend your last day and visit , a small island just off the coast of Sorrento, best known for its picturesque landscapes, and the Blue Grotto, a sea cave that is illuminated by an underwater light, creating a mesmerizing blue hue, a must-see if you are in Amalfi Coast.

The most optimal time to spend on the Amalfi Coast is 3 days which will allow you to really enjoy the Amalfi Coast for a day, as well as spend time and explore the surrounding areas like visiting Pompeii and .",,,,8,6,6,10,7,7,3,9,5,5,1,2026-04-07
Casa Grotta nei Sassi di Matera,Italy,https://goo.gl/maps/UausEnp5gNtGJkoGA,"Not too far from Belvedere di Piazza Giovanni Pascoli, as you make your way down to the lower town, you will find , a small museum dedicated to the preservation and promotion of the traditional Casa Grotta style of dwelling.",,,,3,4,4,0,2,9,4,6,8,8,1,2026-04-07
Casa Noha,Italy,https://goo.gl/maps/998LDHS5s59nfn2k7,"If you want to learn more about the history of Matera and how the cave dwellings came to be, I highly recommend you check out , a small museum dedicated to preserving the history of the Sassi and Matera.",,,,1,3,4,2,5,10,1,5,7,8,1,2026-04-07
Castel Roncolo,Italy,https://goo.gl/maps/Ai9kfQPBTWjBeXeZ6,"Perch on top of a hill 3 km away from Bolzano's city center,  is a medieval castle built in the 14th century, and it is known for its numerous secular frescoes from the Middle Ages.",,,,5,5,20,5,5,5,5,5,5,5,1,2026-04-07
