place,country,google_maps_url,description,region,place_type,blog_source,romance,family,cost,nature,adventure,culture,food,relaxation,service,accessibility,description_count,last_updated
Castel Sant'Angelo,Italy,https://goo.gl/maps/AnxiFpj6MvNv9mmj6,"Once you are done with the Vatican City, located right in front of St. Peter's Square you will find , a fortress, and mausoleum originally built as a tomb for the Roman Emperor Hadrian in the 2nd century AD before it was later used as a fortress, and prison by the Popes, hence why it is so close to the Vatican City.",,,,2,6,0,0,6,10,0,5,6,10,1,2026-04-07
Castello Maniace,Italy,https://goo.gl/maps/AMEC8Wd9D2LgWyko7,"And out of all the tourist attractions to see in Syracuse, no place is more epic than , a medieval castle built in the 13th century designed to protect the city from attacks by sea.

is probably one of the most important and impressive structures in Syracuse and it is located on the southern tip of the island of Ortigia.",,,,5,5,20,5,5,5,5,5,5,5,1,2026-04-07
Castello Svevo,Italy,https://goo.gl/maps/W5FSooUiX2tAjJUt7,"or as it is also called Swabian Castle, is a historic castle located just outside of Bari's Old Town, a place you should definitely drop by as you explore Bari.

Another impressive structure to see in Bari is  or as it is also called Swabian Castle, a historic castle located just outside of Bari's Old Town, built in the 12th Century by the Holy Roman Emperor Frederick II and served as a military fortification, a royal palace, and a prison for the ruler of the city over the centuries.",,,,4,4,12,2,4,7,2,5,6,7,1,2026-04-07
Castello della Zisa,Italy,https://goo.gl/maps/Ad74CPF7Ght3AG8q7,"While you are out and about, visiting the Catacombs of Cappuccini, you can also drop by  and check out is beautiful mixed architectural style interiors Palermo is known for.",,,,5,5,20,5,5,5,5,5,5,5,1,2026-04-07
Castello di Cefalù,Italy,https://goo.gl/maps/g7Rvj9MBB5eug9B9A,"After you are done at the archeological site, you are only halfway to the grand finale of Parco della Rocca di Cefalù, to visit the  or Cefalu Castle, a Norman castle built in the 12th Century right at the top of La Rocca hill.",,,,2,4,4,8,8,10,0,6,4,9,1,2026-04-07
Castello di Riomaggiore,Italy,https://goo.gl/maps/wN5j84E2y33Tde347,"Other notable attractions you should check out while you are here are , 13th-century stone castle perches above the sea with an incredible view, Church of San Giovanni Battista of Riomaggiore, a 14th Century Catholic church with beautiful Gothic features, Riomaggiore Town Hall, offering an incredible view over the town. Spend at least 1 - 2 hours here before we move on to our next destination.",,,,6,5,4,9,4,10,0,7,0,6,1,2026-04-07
Castello di Vezio,Italy,https://goo.gl/maps/PVhiqWYy5vaRByEH8,"The town has a rich history dating back to Roman times, and it is home to several historical and cultural landmarks, such as the , an imposing 12th Century villa with a beautiful view over the lake, and the Villa Monastero, a waterfront villa featuring terraced gardens and a mansion with opulent 1800s decor.",,,,9,6,8,8,3,10,3,9,5,3,1,2026-04-07
Catacombe dei Cappuccini,Italy,https://goo.gl/maps/gCy7swD4rHurs4PS9,"What is creepier than an underground crypt? How about an underground crypt with 8000+ mummified remains on full display, almost as if they are staring at you?  is a series of underground tombs and crypts in Palermo that are filled with mummified remains dating back from the 16th to the 19th century.

If you want to get off the beaten track a little in Palermo, you can also go out and explore other awesome tourist attractions outside Palermo's Old Town like the creepy , an underground crypt with more than 8000 mummified remains on full display.",,,,0,3,8,2,7,10,2,6,8,8,1,2026-04-07
Catacombe di San Giovanni,Italy,https://goo.gl/maps/bS7RcYhfGRgzoBDt9,"When you are done at the archeological park, be sure to check out , a network of underground tunnels located under Syracuse with tombs with beautiful frescoes, sarcophagi, artifacts, and more.",,,,5,5,20,5,5,5,5,5,5,5,1,2026-04-07
Catacombs of St. Callixtus,Italy,https://goo.gl/maps/S8iLxDU2WgiELnSe6,"Some of the most notable attractions along the Appian Way are the , an immense underground cemetery excavated by the Christians of Rome from the 3rd to the 5th century AD, the Catacombs of Saint Sebastian, another ancient tunnel used as an underground tomb, and more, so be sure to check it out while you are here.",,,,1,3,4,2,5,10,0,3,0,6,1,2026-04-07
Catania Airport,Italy,"https://www.google.com/maps/search/catania+airport/@37.4680683,15.0606585,16.04z?coh=164777&entry=tt","From Syracuse, you can catch the same train back to Catania and either spend the night here or take the AMTS ""Alibus"" bus straight to  from the train station bus stop before flying back home. The bus departs every 25 minutes and you can buy the ticket from the general shop at the entrance of the train station or with the driver.",,,,0,0,8,0,0,1,0,1,7,10,1,2026-04-07
Catania Central,Italy,https://goo.gl/maps/kh6V1czckfY8Tzsc9,"From abroad, you just have to fly into Catania, a major travel hub located on the eastern side of Sicily and from there you can take a train from  to Syracuse, taking around 1 hour and cost 9 EUR. You can book the train ticket here.",,,,0,0,8,0,0,0,0,0,1,8,1,2026-04-07
Cathedral of Cefalu,Italy,https://goo.gl/maps/ZS9nSHhpeTmWNdRv8,"One of the most notable landmarks in Cefalu is the , which dates back to the 12th century and is considered one of the finest examples of Norman-Arabic architecture in Sicily.",,,,5,5,20,5,5,5,5,5,5,5,1,2026-04-07
Cattedrale di Pisa,Italy,https://goo.gl/maps/LAanHZ2ueRPF5AYs5,"At Pisa, you can spend the day visiting , go up to the top of the Leaning Tower for an incredible view over the city, and learn more about the history of the place from all the museums around Piazza del Duomo.",,,,5,6,8,2,8,9,2,9,10,8,1,2026-04-07
Cattedrale di San Gerlando,Italy,https://goo.gl/maps/iTnurrnMxgyqQmqC8,"After you climb all the way to the top of Agrigento, you will find , a grand, historic Catholic church known for its elaborate, art-covered ceilings, and it is the highlight of Agrigento's Old Town.

While you are at , be sure to climb up all the way to the roof of the cathedral for an incredible view of Agrigento and its surroundings.",,,,5,5,20,5,5,5,5,5,5,5,1,2026-04-07
Cefalu,Italy,https://goo.gl/maps/GYWZQVzuDa2W7h3D8,"Last but not least, if you have a day to spare in Palermo, I highly recommend you go on a day trip and visit , a historic coastal town on the northeastern part of Sicily, perfect for a day of sunbathing at the beach and hiking around old ruins.

On our second day, we are going on a day trip and visit , a historic coastal town located in the northeastern part of Sicily, perfect for a day of sunbathing at the beach and hiking around old ruins.",,,,4,4,14,7,7,7,2,6,3,4,1,2026-04-07
Cefalu Beach,Italy,https://goo.gl/maps/msvFELgNB6oG4F7w6,"The city is known for its stunning beaches like  and clear waters, making it a popular destination for sun-seekers and beach lovers while the mountainous park of Parco della Rocca di Cefalu behind the city offers a great viewpoint over the coast and a day full of action for adventure-seekers out there.

If you are looking to spend hours at the beach in Cefalu and find Porta Pescara to be crowded, you should check out , a beautiful stretch of sandy beach that stretches across the western coastline for over 1.5 km.

After the hike and exploring the old town of Cefalu, you can spend the entire day relaxing at , a beautiful stretch of sandy beach that stretches across the western coastline for over 1.5 km, and jump into the crystal clear water of the Tyrrhenian Sea at Porta Pescara.",,,,6,6,6,10,6,3,0,9,2,6,1,2026-04-07
Cefalù Cathedral,Italy,https://goo.gl/maps/Zh7sXDsyePXL2FyB7,"One of the most-recognized landmarks in Cefalu is , a striking Roman Catholic located right at the heart of the Old Town featuring beautiful Norman architecture with the iconic sandy brown colored exterior Sicily is known for.",,,,8,6,8,1,3,10,2,9,8,8,1,2026-04-07
Chiesa dei Domenicani,Italy,https://goo.gl/maps/cTDNcBH6xFwn1QiM6,"is a Dominican monastery located right in the city center of Bolzano, near Bolzano Cathedral, and it is a historic religious building that dates back to the 13th century and is an important example of Gothic architecture in the region.",,,,3,4,4,0,1,10,0,6,7,9,1,2026-04-07
Chiesa di San Francesco d'Assisi,Italy,https://goo.gl/maps/31cWQGJ4jh5fu8W86,"While you explore the Upper Town, be sure to drop by , another important church in Matera, and check out its beautiful Baroque-style facade as well as the surrounding Piazza San Francesco Square.",,,,5,5,20,5,5,5,5,5,5,5,1,2026-04-07
Chiesa di Santa Caterina d'Alessandria,Italy,https://goo.gl/maps/mskBYDFvXkSjsAMG8,"Now we have arrived at my favorite church in Palermo, , a grand catholic church located right at the center of Palermo where you can climb to the top of the church to see Palermo's incredible skyline and its surroundings from above.",,,,5,6,8,7,7,10,1,7,5,8,1,2026-04-07
Chiesa di Santa Croce,Italy,https://goo.gl/maps/Tzdag2CtB8hCnSJW7,"There is also several other beautiful architectures around Moneglia you should check out like  and more but if you are not staying overnight in Moneglia, make sure that you are able to catch the train back to where your accommodation is before the last train at around 1:12 AM.",,,,1,2,12,2,1,5,2,7,9,10,1,2026-04-07
Chiesa di Santa Lucia alla Badia,Italy,https://goo.gl/maps/n12DmC3ndVUifEfVA,"Located in the same square as the Cathedral of Syracuse, just right around the corner, you will also find , a Baroque church built in the 18th Century and known for its incredible facade.",,,,5,5,20,5,5,5,5,5,5,5,1,2026-04-07
Chiesa di Santa Lucia alle Malve,Italy,https://goo.gl/maps/vk2TkeME6Z7t6fjBA,"You can spend the day exploring the stone city's narrow streets and check out all the attractions in the Lower Town like , a beautiful church carved from the small mountain, Casa Grotta nei Sassi di Matera, a small museum that recreated what life was like living in the cave back in the days, and Church of Saint Mary of Idris, another Catholic church built into a rocky hilltop.

The church is open from 10 AM to 7 PM every day and the entrance fee is 4 EUR per person. You can also buy a combination ticket which will allow you to visit all 3 churches in the area (, Saint Mary of Idris (this one), and San Pietro Caveoso), all for 8 EUR per person.",,,,2,4,8,4,3,10,0,6,2,7,1,2026-04-07
Chiesa di Santa Maria dei Greci,Italy,https://goo.gl/maps/cRFSds5aL7sMKETc6,"As you explore the old town of Agrigento, you will stumble upon , a 16th Century historic church with beautiful Baroque-style architecture you can visit and escape the heat along the way to go up to the top of the hill.",,,,6,6,8,6,5,10,0,8,1,6,1,2026-04-07
Chiesa di Santa Maria presso San Satiro,Italy,https://goo.gl/maps/7FhjQQ9L6waHvgfj9,"While you are at Milan's city center, you might as well drop by and see , which is an elegant 15th-century church constructed during the Renaissance, located not too far from Duomo di Milano.",,,,5,5,20,5,5,5,5,5,5,5,1,2026-04-07
Chiostro di San Francesco,Italy,https://goo.gl/maps/PYh2iPnkrEuiQmLd6,"After you got the card and settled into your accommodation, you can start exploring this holiday hot spot by visiting its beautiful old town and checking out some important landmarks like , a tranquil 14th Century monastery, perfect for escaping the crowds, stroll around Villa Comunale di Sorrento and check out the ocean view from there.",,,,9,7,4,9,4,9,1,9,4,7,1,2026-04-07
Church of Saint Anthony of Padua,Italy,https://goo.gl/maps/NiUBf1tCqJs1vkRm8,"While you are in Alberobello, be sure to check out the , a historic church featuring the same trulli architecture that made Alberobello famous, Trullo Sovrano, a unique 18th-century conical hut housing a heritage museum, and Territory Museum ""House Pezzolla"", a great museum to learn more about the history.

One of the most unique-looking churches you will find in Alberobello is the  located just south of Monti District just at the end of the street that ascends uphill through all the Trulli houses.",,,,4,5,12,4,4,8,3,6,6,8,1,2026-04-07
Church of Saint Francis of Assisi to the Immaculate,Italy,https://goo.gl/maps/aLBd38Vd4v1i5Ktq7,"Just across the cathedral, you will also find Palazzo Ducezio, another great Sicilian-Baroque style palace built in a style of a French palace of the same period that you should visit as well as other stunning structures in the area like Nicolaci Palace and the .

Several other notable attractions you should not miss in Noto are the , a catholic church known for its beautiful Baroque architecture and intricate decoration, Nicolaci Palace, a palace that offers a chance for us to get a glimpse of what life was like for the nobles living here, and explore the flea market at Villa Comunale Noto.

Entering Noto's Old Town, right out of the bat, you will encounter the striking , a catholic church, one of the many notable religious buildings here and is known for its beautiful Baroque architecture and intricate decoration.",,,,4,4,2,0,1,10,0,5,4,8,1,2026-04-07
Church of Saint John of the Hermits,Italy,https://goo.gl/maps/qNUqRuYBPqERoUjx8,"Not too far from the Norman Palace, you will find the , which is another medieval church worth checking out while you are in the area.",,,,5,5,20,5,5,5,5,5,5,5,1,2026-04-07
Church of Saint Mary of Idris,Italy,https://goo.gl/maps/p6VDJbAgc3Xkky9U8,"As you continue to explore the Lower Town of Matera, you will stumble upon the , one of the most iconic churches in Matera located on top of a rock overlooking the cave city.",,,,5,5,20,5,5,5,5,5,5,5,1,2026-04-07
Church of St. John,Italy,https://goo.gl/maps/q2ihowCkNShNC8h78,"Val di Funes (also known as Villnöß in German) is a valley located in the Dolomites that is known for its stunning rolling hills, an incredible view of the jagged peaks of the Odle mountain range, and one of the most beautiful cultural landmarks in the region, the .",,,,8,6,8,10,8,9,4,8,6,6,1,2026-04-07
Church of St. Margaret of Antioch,Italy,https://goo.gl/maps/Qge7wLLMb6v8Hni87,"You can also visit the , which is a small 14th Century catholic church known for its octagonal tower overlooking the Ligurian Sea.",,,,5,5,20,5,5,5,5,5,5,5,1,2026-04-07
Church of the Gesù,Italy,https://goo.gl/maps/9dD1Ru4LzcoqNykE6,"After you've explored the street food scene of Palermo, it is time to visit some of the tourist attractions here. One of the first places I highly recommend you start exploring is the , a Jesuit church in Palermo, considered one of the most important Baroque churches in the city.",,,,3,5,8,0,2,10,2,6,8,9,1,2026-04-07
Cinque Terre,Italy,https://goo.gl/maps/GoKWeo974qBUPgTU6,"After many days spent inland and in the mountains, it is time to explore the coast of Northern Italy and there is no better place to do so than , a beautiful coastline known for its picturesque colorful villages you often see on Instagram.

If you are looking to explore some of the coastal towns of Northern Italy, you can't go wrong with , a beautiful coastline known for its picturesque colorful villages you often see on Instagram.",,,,6,5,14,8,4,6,6,6,6,4,1,2026-04-07
Clock Tower,Italy,https://goo.gl/maps/QkDbrLJtsdzescnU7,"There are several unique features at the square that you should definitely check out while you are here from the , an astronomical clock adorned with gold leaf and intricate carvings, and the 12th Century granite columns of Saint Theodore and Saint Mark standing at the entrance of the piazza.",,,,6,5,4,4,2,10,0,7,0,5,1,2026-04-07
Colosseum,Italy,https://goo.gl/maps/UxeAVJKGAjrTCqyw6,"For the second day in Rome, we are going to start early again and be at the  around 7:30 AM so you can stroll around the area and get some photos without the crowds.",,,,5,5,20,5,5,5,5,5,5,5,1,2026-04-07
Costiera Amalfitana Positano,Italy,https://goo.gl/maps/fSMFe4JKMurXNq4fA,"You can stroll along the narrow streets of Amalfi Coast and make your way to  along its winding coastal roads for an incredible view overlooking the sea. It is quite a walk through and with the summer heat, it can be quite difficult to tackle if you are not used to the heat so take it slow.",,,,7,5,8,10,8,5,0,9,2,5,1,2026-04-07
Crestarella,Italy,https://goo.gl/maps/QZXxL2ak9sEt5aw26,"Notable attractions in Vietri sul Mare you shouldn't miss are , a beautiful beach tucked away behind a medieval tower, Villa Comunale Vietri sul Mare, a beautiful park with an incredible view over the coastline, and explore its winding roads around the Old Town.",,,,9,7,4,10,5,8,0,9,2,6,1,2026-04-07
Doge's Palace,Italy,https://goo.gl/maps/K2rYQwKkmEmZT1oS7,"There are many iconic landmarks in Venice that you should definitely check out while you are here like , a magnificent palace and the residence of the Doge, the elected leader of the Republic of Venice and served as the city's government headquarters, as well as a symbol of the Republic's independent, power, and prestige.

Nestled among all the other attractions in St. Mark Square, you will find , a magnificent palace and the residence of the Doge, the elected leader of the Republic of Venice and served as the city's government headquarters, as well as a symbol of the Republic's independent, power, and prestige.",,,,6,5,4,0,3,10,1,8,9,9,1,2026-04-07
Dolomites,Italy,https://maps.app.goo.gl/G2YcMRJaDzmNxVK29,"First and foremost, we start in the , probably one of my favorite regions to explore in Italy. Nestled right at the heart of the Italian Alps, the  are one of the most beautiful mountain ranges in the world. It is a hiker's paradise with an abundance of incredible hiking trails that wind around some of the most stunning peaks in Europe.",,,,4,6,8,10,10,0,0,7,1,7,1,2026-04-07
Dreizinnenhütte,Italy,https://goo.gl/maps/bhwjELFDR2gX8gQcA,"Once you are done resting at Paternsattel, you can continue along the trail towards , a mountain hut located at an altitude of 2,100 meters (6,890 feet) offering all kinds of amenities, including a restaurant, a bar, and even accommodation.",,,,3,3,4,9,8,3,5,9,7,5,1,2026-04-07
Duomo - Via Vernieri,Italy,https://goo.gl/maps/ArC8Ued79vsgbeUGA,"You can also go further to Salerno by train and get off at  station to explore the winding narrow streets of Salerno's old town and visit the impressive Cattedrale di Santa Maria degli Angeli, and ornate church built in the 11th Century featuring a large bell tower, many mosaics, statues, and relics, as well as one of the most beautiful crypts I have ever seen.",,,,5,4,4,2,4,10,0,7,2,8,1,2026-04-07
Duomo di Amalfi,Italy,https://goo.gl/maps/Enuw69YxNieF76HNA,"While you are in Amalfi, be sure to check out , a beautiful 9th Century cathedral known for its iconic Norman-Arab-Byzantine-inspired stripe facade as well as the 1800s frescoes you can find inside. It's a nice walk from the bus stop and one of the first places you should visit while here.",,,,4,3,4,0,0,10,0,7,3,7,1,2026-04-07
Duomo di Como,Italy,https://goo.gl/maps/PfQKHYjTXMbQALy86,"First and foremost, I recommend you check out , a large cathedral located right in the center of Como's Town Square. The cathedral was built in the 11th and 12th centuries in the Romanesque style. It has a beautiful façade with a large rose window and three portals and is decorated with a variety of sculptures and reliefs.",,,,5,5,4,1,1,9,0,7,2,9,1,2026-04-07
Duomo di Milano,Italy,https://goo.gl/maps/9MkchPztzttUqQrW6,"With 2 nights in Milan, you can dedicate an entire day to exploring all the highlights of Milan by beginning in the city center and visiting , the largest cathedral in the country featuring over 135 adorned spires, thousands of statues, all intricately sculpted to perfection, and a beautiful interior adorned with dark and gritty Gothic decors. No wonder why it took over 600 years to complete!",,,,5,4,8,0,2,10,0,6,7,9,1,2026-04-07
Duomo di Siena,Italy,https://goo.gl/maps/mtaMaU2NVHfdg4Zp6,"Siena is also home to a number of museums and art galleries that showcase the city's rich cultural heritage, as well as the impressive , a 13th Century cathedral famous for its facade and its marble stripes in symbolic black and white pattern.",,,,5,5,8,0,1,10,1,7,7,9,1,2026-04-07
Ear of Dionysius,Italy,https://goo.gl/maps/3pEbCr74qhiyGx8k8,"Other notable attractions in the park are the , a sinuous ancient cave with a legend claiming it was built by the tyrant Dionysius, a cruel, suspicious, and vindictive ruler of Sicily in the 1st Century BC, the ancient quarries of Latomie del Paradiso, and more.",,,,2,5,4,8,8,10,0,5,0,4,1,2026-04-07
East Entrance,Italy,https://goo.gl/maps/t9a2BpdLc6N4jfkd6,"The park is pretty big and it can take between 2 - 3 hours to see them all. It is also divided into 2 sections with 2 entrances and if you plan to visit the archeological site by public transportation, the best way to do it is to enter the park from the  and exit from the West Entrance, that way you won't need to backtrack your way after you are done.

From Agrigento, there are several ways to get to the Valley of the Temples independently, but the best way I found is to walk from the city to the park and enter from the . The walk should take about 20 minutes and you are going downhill so it should be pretty easy and straightforward.

To reach the Valley of the Temples, you first need to travel to Agrigento, a small city near the southern coast of Sicily. You can easily reach Agrigento by train from Palermo. Once there, you can walk to the  of the Valley, spend a minimum of 2 hours exploring, and then exit from the West Entrance, where you can catch a bus back to Agrigento.",,,,1,4,6,7,7,9,0,7,4,8,1,2026-04-07
Fiumi Fountain,Italy,https://goo.gl/maps/M83PWL5UXDeUg5yFA,My favorite fountain in the square is the  which has incredibly intricate sculptures that pay homage to the 4 rivers of Rome and it features a striking obelisk right at the center of the fountain. The details of this fountain will truly blow you away.,,,,7,6,4,8,4,9,0,8,0,3,1,2026-04-07
Florence,Italy,https://goo.gl/maps/2tb3rSvK1EYegSRg6,"is the stunning capital city of the Italian region of Tuscany, home to world-renowned art, delicious cuisine, and probably one of the most iconic churches in the world, Duomo di Firenze, a structure that will completely blow your socks off the moment you see it in person.",,,,8,7,8,0,2,10,7,9,9,7,1,2026-04-07
Florence Train Station,Italy,https://goo.gl/maps/yZZGkS7dtRip6i5x7,"From Bolzano to Florence, you can also catch a train from Bolzano Train Station to  between 5:00 AM and 5:10 PM every day with a direct train taking around 3 hours and costing between 46 - 60 EUR.

From Florence, it is pretty easy to get to Pisa or Siena via trains. They are both around an hour's train ride away from Florence and you should be able to easily catch one of the main trains from .

From Florence, there are plenty of direct trains you can catch from  that will take you to Rome in a little over 5 hours.",,,,4,4,16,5,5,5,4,5,5,6,1,2026-04-07
Flower Festival of Noto,Italy,https://goo.gl/maps/u5f42EZpMpB6deoU6,"For the best time to visit Noto, if you can choose when to visit Noto, I highly recommend you align your trip on the day of the , an annual flower event where the city is lit up with colorful flowers, spread out across the main street of the Old Town.",,,,6,4,4,9,4,9,1,9,2,3,1,2026-04-07
Fontana Nettuno,Italy,https://goo.gl/maps/3xDCpvUsNKx421g9A,"Once you are acquainted with Bolzano, you can spend the evening exploring the market street of . Lots of nice restaurants around the area.

(Neptune Fountains) is a historic fountain located right in the center of the main pedestrian street of Bolzano and it is one of the most recognized landmarks in the city.",,,,5,5,20,5,5,5,5,5,5,5,1,2026-04-07
Fontana Pretoria,Italy,https://goo.gl/maps/H2iaKDxddHdnETPY8,"Right at the heart of Palermo, surrounded by all the beautiful churches of the city, you will find , a historic fountain that dates back to the 12th Century.",,,,5,5,20,5,5,5,5,5,5,5,1,2026-04-07
Fontana di Diana,Italy,https://goo.gl/maps/HUwdNp2osD3JPcKy8,"As you make your way down across the island, you will stumble upon  or the Fountain of Diana is a stunning Baroque-style fountain built in 1907 featuring a magnificent statue of Diana, the ancient Roman goddess of the hunt, holding a bow and an arrow.",,,,7,5,0,8,3,10,0,8,0,3,1,2026-04-07
Forcella del Col de Mezzo,Italy,https://goo.gl/maps/cCQqzigoz23ewDsHA,"After you spend some time at Rienzquelle, you can then continue on towards , another mountain pass on the western side of Tre Cime di Lavaredo that lies at an altitude of 2,230 meters (7,316 feet).",,,,5,5,20,5,5,5,5,5,5,5,1,2026-04-07
Franciscan Monastery,Italy,https://goo.gl/maps/m3WNikfcFMyXt1As5,is a religious complex that was founded in the 13th century by the Franciscan order and it is located not too far from Fontana Nettuno.,,,,5,5,20,5,5,5,5,5,5,5,1,2026-04-07
Galleria Vittorio Emanuele II,Italy,https://goo.gl/maps/jAdZgEd99bFKn1zA8,"While you are in the city center, be sure to check out the famous , an open-air mall housed in this stunning glass-vaulted arcade as high as a skyscraper that is home to a wide variety of high-end stores, restaurants, and cafes that will test the depth of your wallet.",,,,3,4,8,0,2,9,5,4,7,8,1,2026-04-07
Gallerie dell'Accademia,Italy,https://goo.gl/maps/nqhBSbePmHhYUsHz5,"There are so many awesome museums in Venice that it is to recommend just one in this travel guide. I mean, Venice is the birthplace of the Renaissance after all, right? If you have time and would like to learn a bit more about Venice and its accomplishment, be sure to drop by , which is a museum you should check out.",,,,1,1,8,0,0,9,0,0,0,0,1,2026-04-07
