place,country,google_maps_url,description,region,place_type,blog_source,romance,family,cost,nature,adventure,culture,food,relaxation,service,accessibility,description_count,last_updated
Garden of the Fugitives,Italy,https://goo.gl/maps/dSNxskE3oi82gZ5G6,"Now, it's time to visit the true highlight of Pompeii. I know you have been waiting to see the casted bodies of the Pompeians for so long and there is no better place to see them than at the .",,,,5,5,20,5,5,5,5,5,5,5,1,2026-04-07
Giardino della Kolymbethra,Italy,https://goo.gl/maps/3ehwARH55sHPLriW8,"If you bought the combined full ticket, you will also have access to  or the Garden of Kolymbethra, a botanical garden located not too far from the Temple of Dioscuri.",,,,5,5,20,5,5,5,5,5,5,5,1,2026-04-07
Giotto's Bell Tower,Italy,https://goo.gl/maps/ZiEeMRSqDWsJCKNeA,"No matter what you choose to do here, I highly recommend you climb , an iconic medieval tower standing at over 84.7 m (277.9 feet) tall, offering breathtaking views of the city and the surrounding Tuscan countryside. It is hands down, the best viewpoint you can get in the city especially if you want to see the massive dome of the Duomo up close.

There are so many things you can do in this city alone like admiring the beauty of Duomo di Firenze from every angle, going up to the top of  and admiring the giant dome of the Duomo from above, and checking out Piazzale Michelangelo, a public square located on top of a hill overlooking Florence, for an incredible view of Florence at sunset.",,,,7,6,4,10,6,10,0,8,1,5,1,2026-04-07
Greenway dei Patriarchi,Italy,https://goo.gl/maps/Mgr8iMF9QrHmmni16,"Other than the history, Varenna also has one of the most beautiful lakeside promenades out there. One of the highlights of Varenna is to stroll along the beautiful , a romantic lakeside walk that will take you to Varenna's beautiful old town.",,,,8,5,4,10,4,9,0,10,2,6,1,2026-04-07
Gschnagenhardt-Alm,Italy,https://goo.gl/maps/uavPETeMm8JzFRW56,"The trail will take you to the picturesque , a mountain hut located right in the center of a natural amphitheater, formed by the towering cliffs of the Odle mountain range, which rise up to over 2,500 meters (8,200 feet) above the valley floor.",,,,6,7,4,10,10,6,1,8,1,5,1,2026-04-07
Gusto Di Mare,Italy,https://goo.gl/maps/c9Njs7BoqqqzrEsH9,"If you are looking for a family-run restaurant that serves delicious and fresh seafood dishes, I highly recommend you check out , one of my favorite restaurants in Palermo that I often frequented when I was here.

That should keep you occupied for the entire day in Palermo. In the evening, you can check out many of the family-run restaurants like , one of my favorite restaurants in Palermo serving seafood dishes at affordable prices, and Pizzeria Polleria Zummo, another great family-run restaurant that serves delicious authentic pizzas. Once you are done, you can retreat for the night and prepare for our day trip to Cefalu the next day.",,,,2,6,12,0,2,8,10,6,8,6,1,2026-04-07
Hotel Lago di Braies,Italy,https://goo.gl/maps/BPzqaXBvKyderbRH6,"In addition to outdoor activities, Pragser Wildsee has a number of other attractions to offer visitors. These include , a historic hotel located on the shores of the lake, and a number of restaurants, cafes, and shops, for you to indulge yourself in.",,,,5,5,8,8,7,6,8,8,7,3,1,2026-04-07
House of Venus in the Shell,Italy,https://goo.gl/maps/6mYrsfWQMKnG4Web6,"is another of my favorite Roman houses in Pompeii, known for its beautiful fresco of Venus, the Roman goddess of love, rising from a shell.",,,,5,5,20,5,5,5,5,5,5,5,1,2026-04-07
House of the Faun,Italy,https://goo.gl/maps/o1pWopgKufvJN3Qg8,"A few minutes' walk, just southeast of Villa dei Misteri, you will find , one of the most famous and well-preserved houses in Pompeii and it is considered to be one of the grandest and most opulent houses in the city.",,,,2,4,4,0,4,10,2,7,8,10,1,2026-04-07
House of the Vettii,Italy,https://goo.gl/maps/RTAqzkfwRNr5mbf26,"Next to the House of Faun, you will find the , another well-preserved Roman house built in the 1st century BC, covering an area of more than 1,300 square meters.",,,,5,5,20,5,5,5,5,5,5,5,1,2026-04-07
Il Cuore Di Napoli Ribelle Restaurant,Italy,https://goo.gl/maps/HeAshEt821wMzpYa6,"And that is it for our last day in Rome. You can spend some time and explore the area where your accommodation is located or check out some of the many awesome local restaurants in Rome like , one of my favorite family-run restaurants in the city.",,,,4,6,12,0,1,9,10,8,8,6,1,2026-04-07
Il Fortino di Sant'Antonio,Italy,https://goo.gl/maps/KoEJLJNyaqNdpFweA,"As you explore the coastline of Bari, you will stumble upon , a formidable historic fortification that was built way back in the 16th Century as a defensive structure to protect the city from invasions and attacks from the sea.",,,,2,4,4,7,8,10,0,7,5,9,1,2026-04-07
Karersee,Italy,https://goo.gl/maps/nmb3y923dJgh13dq6,"Located in the Trentino-Alto Adige region of northern Italy, near the border with Austria,  is a picturesque mountain lake known for its stunning natural beauty, crystal-clear waters, and breathtaking views of the surrounding mountains.",,,,8,7,8,10,8,4,3,10,7,8,1,2026-04-07
L'antica Panineria Restaurant,Italy,https://goo.gl/maps/RDkTxonBmqcZsfKEA,"Before you enter the Old Town via Porta Di Ponte, be sure to stop by  located not too far from the historic gate, and try out the local delicacy here.

For the best street food in Agrigento, you gotta try Panino Con Milza (schietto), a traditional street food in Sicily made out of soft bread stuffed with boiled, fried chopped veal lung, and spleen, from .

After you are done exploring the Old Town's attractions, it's time to explore the street foods of Agrigento! While here, you gotta try Panino Con Milza (schietto), a traditional street food in Sicily made out of soft bread stuffed with boiled, fried chopped veal lung, and spleen, from .",,,,2,3,10,2,3,8,8,4,5,4,1,2026-04-07
L'arte della focaccia 2,Italy,https://goo.gl/maps/pLnEbFUHs8AdZV1B6,"One of the best things to do in Bari is to check out its street food scene and one of the best places to do that is , a small street stall known for its delicious street food at an affordable price. Like really REALLY affordable!

Or you can explore Bari's incredible street food scene by visiting , a small street stall known for its delicious street food at an affordable price. Like really REALLY affordable!",,,,2,4,16,3,2,4,7,4,2,3,1,2026-04-07
La Nuova Mensa,Italy,https://goo.gl/maps/6i1Lh2JLJ1Q3SGmd8,"If you are looking for an affordable local family-run restaurant to try in Syracuse, I highly recommend , a nice cafeteria-style restaurant that offers a selection of local dishes each day.",,,,5,5,20,5,5,5,5,5,5,5,1,2026-04-07
Lake Como,Italy,https://goo.gl/maps/KXACuiFGHHX447q78,"Nestled in the foothills of the Italian Alps,  is a beautiful lake set against the backdrop of the Italian Alps and it is known for its picturesque towns, stunning old villas, and beautiful lakeside views that is straight out of a fairy tale.",,,,10,6,4,10,4,9,2,9,3,4,1,2026-04-07
Lenno,Italy,https://goo.gl/maps/h4rrsWwvQL4vkGXm9,"Getting to this villa requires a bit of effort but I guarantee you, it will be worth your while. From Tremezzo, it will take about 10 minutes before you have to get off at , the closest town to the villa. Once you are here, you will then have to walk along the shoreline for around 30 minutes until you arrive at the entrance by around 3:30 PM.",,,,3,4,8,10,8,1,0,8,3,5,1,2026-04-07
Leonardo da Vinci International Airport (FCO),Italy,https://goo.gl/maps/Xw6tvhKurX4W4Tjf7,"The easiest way to get to Alberobello from abroad is to fly to . To find a cheap flight to Rome, I would recommend you use Skyscanner or Expedia to look for the cheapest route and schedule so you can compare and pick the best one.

Our itinerary will begin in Rome so that is where you will have to fly to in Italy. Rome is a huge travel hub of Europe and you can easily find many flights flying in and out of  without problems.

People also like to visit Rome with the Amalfi Coast and so if you are planning to do that, you can also fly into Rome and its , and then they catch a train from Rome to Salerno or Naples.",,,,4,4,16,4,4,4,4,4,4,4,1,2026-04-07
Libreria Acqua Alta,Italy,https://goo.gl/maps/4uH1Tv6aiKYfyKmy8,"One of my favorite places in Venice is , a beautiful vintage bookstore built around a small courtyard that features a canal running through it.",,,,5,5,20,5,5,5,5,5,5,5,1,2026-04-07
Lido di Menaggio,Italy,https://goo.gl/maps/6JxeZcHXFhVw9RwD7,"Other notable tourist attractions in Menaggio include , a popular spot for swimming and sunbathing in the summer months, St. Stephen's Church, a beautiful church of architectural and historical significance, and Percorso salute Parco Val Sanagra, a beautiful park set against the Italian Alps. Or you can just relax here and have lunch before we continue our journey.",,,,5,6,4,10,4,8,1,9,3,5,1,2026-04-07
Life Electric Monument,Italy,https://goo.gl/maps/XTECnNfMvSRTt6UB8,"Other notable things you can do in Como include visiting the , Tempio Voltiano Museum, and checking out another cool villa, Villa Olmo, an 18th Century villa featuring beautiful gardens and exhibitions which should be open until 11 PM in the summer.",,,,5,5,4,8,3,10,3,8,2,3,1,2026-04-07
Loacker cafe,Italy,https://goo.gl/maps/CggWKGnNBbPQfkoNA,"It is also a great place to experience the rich cultural heritage of the region, with a mix of Italian and German influences you won't find anywhere else in Italy. Fun fact, the chocolate wafer brand Loacker was founded here and Bolzano is one of the few places you can visit a full-fledged .

Fun fact, the chocolate wafer brand Loacker was founded here and Waltherplatz is where you would find a full-fledged , one of the few you can visit in the world.",,,,6,4,16,6,4,8,6,6,5,3,1,2026-04-07
Lungomare Araldo di Crollalanza,Italy,https://goo.gl/maps/KJA9cjWPhj3nKw6a6,"Bari is a city known for its rich cultural heritage that dated all the way back to the 9th Century BC, some of the best and most affordable cuisine in the country, and a picturesque coastline, and there is no better place to start exploring than at .

Traveling from the Amalfi Coast to Bari, you should arrive in the city a little bit before sunset, in time for a beautiful stroll around the city's old town and its stunning coastline. Once you arrive, I highly recommend you hit the ground running and go for a stroll along the  to get some fresh sea breeze before we explore the old town.",,,,6,6,6,9,5,9,4,8,4,4,1,2026-04-07
Mamma Mia 2 Pizzeria Restaurant,Italy,https://goo.gl/maps/Xrig24dhPDVv6Jrv6,"is my favorite restaurant in Moneglia. If you are visiting Moneglia or are staying overnight here, I highly recommend you check the place out for dinner and order their pizzas or my favorite dish, the Seafood Pasta, one of the most delicious seafood pasta I tried in Italy.",,,,4,7,12,0,1,7,9,7,9,8,1,2026-04-07
Manarola,Italy,https://goo.gl/maps/Mmc38dSBxqKBgZbt6,"After you are done at Riomaggiore, you can take the train towards Genoa and get off at the next station in , another of the 3 most beautiful villages in Cinque Terre.

If you will do whatever it takes to stay in a hotel with views of the iconic colorful houses of Cinque Terre, then you might want to look at staying in Vernazza, , or Riomaggiore.",,,,5,5,20,5,5,5,5,5,5,5,1,2026-04-07
Maretsch Castle,Italy,https://goo.gl/maps/A3eCoWHcEmTLNbjp6,"is another important landmark in Bolzano. It is a small medieval castle built in the 13th century best known for its Renaissance-era round-corner towers and frescoes, located not too far from the city center.",,,,5,5,4,0,2,10,0,7,6,9,1,2026-04-07
Maria delle Sgagliozze,Italy,https://goo.gl/maps/zf4Gv2XxMo39rJUs7,"Another street food you should try is the famous fried corn porridge from , a popular traditional-style street food that has been selling from this very stall for many years.",,,,5,5,20,5,5,5,5,5,5,5,1,2026-04-07
Massimo Theater,Italy,https://goo.gl/maps/5FMYMjohd614myww6,"is a lavishly decorated theater, built in the late 19th Century, and is one of the largest theaters in Italy and an incredible landmark in Palermo you should visit.",,,,5,5,20,5,5,5,5,5,5,5,1,2026-04-07
Matera,Italy,https://goo.gl/maps/4X2zk5FqCJSDrF978,"One of the best day trips you can make from Bari is to visit , a city known for its unique cave dwellings, beautiful stone cityscape, and the place where they shot many scenes of the last James Bond movie with Daniel Craig, 007: No Time to Die.

is one of my favorite places in Central Italy. The city is best known for its unique cave dwellings, beautiful stone cityscape, and the place where they shot many scenes of the last James Bond movie with Daniel Craig, 007: No Time to Die.",,,,5,6,4,10,8,10,2,8,2,4,1,2026-04-07
Matera Central Bus Station,Italy,https://goo.gl/maps/t9uhtPsTxNVZk8Qm8,"Despite the distance, the walk is pretty straightforward and flat so no need to worry. There are ways to get closer to the old town from Bari but it requires you to take the L2 train to Bari's Airport, which does not run as often as regular trains, and from the airport, catch a bus to Matera via Pugliairbus which will eventually drop you off at . Since the bus and train do not run very often, it is difficult to align the time to match each leg so I do not recommend this way.

Going back, on the other hand, is a different story. Since you are no longer time sensitive, instead of walking all the way back to the further away bus stop, you can catch the Pugliairbus from  to get to the airport and from there, you can either catch the L2 train or the airport shuttle bus which leaves every 30 minutes. Either or, going back have pretty much the same option as getting here but just in reverse. You can choose whichever method you feel comfortable doing.

After you are done, you can head back to Bari either via Italbus leaving from the bus stop here which is a 30-minute walk away from the old town or you can catch the Pugliairbus from  to get to the airport and from there, you can either catch the L2 train or the airport shuttle bus which leaves every 30 minutes to Bari and retreat for the night.",,,,0,0,6,0,0,1,0,1,2,8,1,2026-04-07
Menaggio,Italy,https://goo.gl/maps/pppLFdb33tUGNnpV7,"Across the lake from Bellagio, you will find , another small charming town located on the western shore of Lake Como and it is known for its beautiful narrow streets, hillside town, and beautiful promenade full of lovely cafes and restaurants.

is another small charming town located on the western shore of Lake Como and it is known for its beautiful narrow streets, hillside town, and beautiful promenade full of lovely cafes and restaurants. You can spend about an hour resting and relaxing before we take the bus to Villa Carlotta and Villa del Balbianello, some of the prettiest lakeside villas you will see in Italy.",,,,10,6,4,10,4,7,7,9,7,2,1,2026-04-07
Menaggio Castle,Italy,https://goo.gl/maps/LcEDZbWX32xQ71Rf7,"There is a nice walking trail in Menaggio you can take that will take you from the shore of the town uphill through the charming hillside area along narrow colorful cobblestone streets until you reach , a castle that dates back to the 11th century and located on a hill overlooking the town.",,,,6,6,4,10,7,10,0,8,0,3,1,2026-04-07
Mercato del Capo,Italy,https://goo.gl/maps/ZcyFB9vqmEzHQ9oRA,"For the best markets to visit in Palermo, I highly recommend you check out  and Trh Palermo Ballaro, with the former a little more proper with street food stalls whereas the latter is more random with all kinds of things being sold here from fresh produce to souvenirs.",,,,0,3,8,0,1,9,10,5,5,5,1,2026-04-07
Metropark Centrale,Italy,https://goo.gl/maps/d8xLg9j1qLthHCXf6,"Once you arrive in Naples, you can catch a bus operated by Flixbus to Bari from  only a few minutes walk from Naples Central Train Station. There are around 8 buses per day from 9:30 AM to 8:30 PM every day and the journey should take about 2.5 hours and cost between 12 - 22 EUR. You can book the Flixbus ticket here.",,,,0,0,8,0,0,0,0,0,5,10,1,2026-04-07
Milan,Italy,https://goo.gl/maps/LPvWje7FKjg8Qs8e9,"Our 2 weeks backpacking journey across Italy begins in , a world-renowned art and fashion capital of the world, home to some of the most iconic monuments and landmarks in Italy from the incredible artwork of famous artists like Leonardo da Vinci to all the historical churches and architectures that have stood the test of time for centuries.",,,,5,5,12,0,6,10,5,8,10,8,1,2026-04-07
Milan Centrale,Italy,https://goo.gl/maps/EQx9NQNYcnT5UL449,"Once you arrive in Milan, you are going to have to get yourself to  and catch one of the many trains to Varenna. The direct trains between these 2 places run between 6:20 AM to 9:20 PM every day and the journey should take about 1 hour and costs around 8 EUR. You can book the train ticket here.

You take one of the many trains from  to Bergamo Train Station, which should take about 50 minutes. From the train station, it is another 30 minutes leisurely stroll through the Lower Town to get to the Upper Town.

From Cinque Terre to Milan, you should be able to catch a train from one of the 4 famous towns (Monterosso, Vernazza, Manarola, and Riomaggiore) that will take you directly to  in about 3 hours.",,,,2,3,10,5,5,4,2,5,6,8,1,2026-04-07
Milan's Malpensa Airport,Italy,https://goo.gl/maps/GJcrbKpSZ2yu8xnZ9,"Most trip in Northern Italy begins in Milan and so first and foremost, you will have to find a flight from your hometown to .",,,,5,5,20,5,5,5,5,5,5,5,1,2026-04-07
Milano Central Train Station,Italy,https://goo.gl/maps/1o9RxgGkum5qfrTy8,"From Milan to Venice, you are going to have to catch a train from . There are several direct trains connecting both cities starting at 7:15 AM to 8:45 PM. The journey should take about 2.5 hours and cost 45 EUR. You can get your train ticket online from here.

From Milan to Lake Como, you can take one of the many trains from  to Varenna, in the heart of Lake Como. There are many trains running this route starting at 6:20 AM all the way to 9:20 PM every day. The journey should take about 1 hour and it can cost around 8 EUR. You can get your train ticket online from here.

From Lake Como to Venice, you are going to have to catch the one-hour train back to  and from there, you should be able to find a train to get to Venice.",,,,2,2,10,4,4,2,2,4,6,8,1,2026-04-07
Monache cistercensi santo spirito,Italy,https://goo.gl/maps/U8uoAksVZF7KiDoW7,"While you explore the crisscrossing streets of Agrigento Old Town, be sure to check out some of the most notable attractions in the area such as , a beautiful church featuring incredibly detailed stucco sculpture, Chiesa di San Lorenzo detta del Purgatorio, a church with a beautiful facade, and all the small narrow streets with local houses decorated with flowers lined up the hill all the way to the top.",,,,7,5,8,3,2,10,0,8,2,7,1,2026-04-07
Moneglia,Italy,https://goo.gl/maps/GSpV2ND5VR7ipyob6,"If you are looking for a less crowded place to spend your evening at the beach with a beautiful charming old town that you can stroll in leisurely without having the wade through people, there is no better place to be than .

If you prefer a more quiet place that rarely gets any crowds, a beautiful coastal area with rich history, and a more authentic place to stay where beaches are within walking distance, I highly recommend staying way up north in towns called .",,,,8,4,6,10,4,8,2,9,2,2,1,2026-04-07
Moneglia beach,Italy,https://goo.gl/maps/Rq4fwM5s9EXRdKv59,"If you are there in the evening, I highly recommend you check out , a long strip of sandy beach where you will be able to relax and watch the sun dip behind the horizon. It is not as crowded as the beaches in Monterosso and there are even fewer people in the evening here. Since I love experiencing sunset in solitude, I couldn't ask for a better place than this!",,,,7,4,4,9,2,0,0,9,0,5,1,2026-04-07
Monreale Cathedral,Italy,https://goo.gl/maps/HYMWBFVcF6zn5xQc8,"If you do not want to deal with the logistics, you can also visit Cefalu with an organized tour group which will take you to Cefalu and back as well as visits other tourist attractions like , known for its incredible frescoes, all in one go which is an awesome deal since Monreale is not so easy to get to via the public transportation.",,,,0,1,8,0,1,7,1,1,0,2,1,2026-04-07
Monterosso,Italy,https://goo.gl/maps/8jroDZ4rop9VAeTV8,"If you have been looking forward to spending some time at the beach in Cinque Terre, I am happy to tell you that we have now arrived at one of the best places to do just that.  is the beach town of Cinque Terre with access to a long strip of white sand beach you can enjoy.

Cinque Terre is made up of five small villages that are located along the Italian Riviera. The 4 best places you should definitely check out while you are here are , Vernazza, Manarola, and Riomaggiore.

If you don't mind a little crowd and you want to be near beaches and commercial district that is typical of beach towns in Europe, you can also stay at .",,,,7,6,12,8,6,6,5,8,6,5,1,2026-04-07
Monti District,Italy,https://goo.gl/maps/5arRXnn45YUb8tMi7,"After you are done taking photos of Monti from the viewpoint, it is time to hit the road and start exploring the famous  (Rione Monti) properly.",,,,5,5,20,5,5,5,5,5,5,5,1,2026-04-07
Museo Archeologico Nazionale,Italy,https://goo.gl/maps/8eeU8msiGvAvEN8t9,"Other notable museums in Venice include , an archeological museum housing ancient Egyptian, Greek, Roman, and Babylonian antiquities, as well as more than 40 museums in the city.",,,,5,5,20,5,5,5,5,5,5,5,1,2026-04-07
Museo Correr,Italy,https://goo.gl/maps/h5rkLq69Ys7uqupa7,"For a history lesson about Venice, you can't go wrong with , a museum that will offer a comprehensive overview of the history of Venice and its art, from the early middle ages to the 19th century. It is located right by St. Mark Square so you should be able to easily drop by there as you explore the area.",,,,2,3,4,1,2,10,0,6,8,9,1,2026-04-07
Naples,Italy,https://goo.gl/maps/S7NwmC4ZnWZwPmHv8,"Congratulations! You have completed the ultimaite 2 weeks backpacking itinerary across Italy. After spending 2 weeks here, it's time to head back home. The closest international airport you can fly out from is in  so you can either spend a night here before heading back or leave Sorrento early and take the Alibus to the airport straight away. Go ahead and celebrate to your heart's content. You deserve a good nice rest after such a long trip! Enjoy !

After spending a week in Italy, it's time to head back home. The closest international airport you can fly out from is in  so you can either spend a night here before heading back home or leave Sorrento early and take the Alibus to the airport straight away, completing our backpacking itinerary.",,,,0,0,8,0,1,0,0,2,0,6,1,2026-04-07
Naples International Airport (NAP),Italy,https://goo.gl/maps/mDtjqh17TUvMJUYY6,Naples is the closest city with the largest travel hub in the area and you should be able to find direct flights from anywhere to its  without problems.,,,,5,5,20,5,5,5,5,5,5,5,1,2026-04-07
Naviglio Grande,Italy,https://goo.gl/maps/98syzxBMcw5G3fXZ7,"Spend your evening relaxing at Sforzesco Castle until sunset and then make your way to . As you walk, be sure to drop by and check out the Roman Columns of San Lorenzo, a group of ancient Roman columns located near the city center of Milan, believed to be from the 2nd century AD as part of a larger public building or temple. It is one of the oldest structures in the city.

Spend your last day in Milan, chilling, enjoying all the delicious foods, and indulging yourself in all that this city has to offer. If you are looking for an alternative place to hang out, be sure to check out .",,,,4,4,6,5,3,8,5,8,4,6,1,2026-04-07
Neapolis Archaeological Park,Italy,https://goo.gl/maps/uskALaWqB6NGbCqY9,"Right out of the bat, you can spend the morning exploring all the tourist attractions in the city before we move over to the old town area. Attractions like  offers a large green space for a nice morning stroll as you explore the ancient ruins of Syracuse.

After spending time on the island of Ortigia, it is time to explore what the mainland of Syracuse has to offer, and there is no better place to begin this journey than at the .",,,,4,6,12,8,6,6,2,7,3,4,1,2026-04-07
Nicolaci Palace,Italy,https://goo.gl/maps/ELT8gReqjNXvR2N67,"is another beautiful palace you can visit in Noto. Located not too far from Noto Cathedral, the place offers a chance for us to get a glimpse of what life was like for the nobles living here.",,,,5,5,20,5,5,5,5,5,5,5,1,2026-04-07
No Mafia Memorial,Italy,https://goo.gl/maps/iHrUaB4fY2t69Gnz6,"Just west of Quattro Canti, you will find , a museum dedicated to telling the stories of the city's fights against the mafias that had ruled Sicily for centuries and rid the city of their influences once and for all.",,,,1,4,4,2,6,10,2,6,9,10,1,2026-04-07
Norman Palace,Italy,https://goo.gl/maps/mtFVx6PPZieqQFHM8,"is another important landmark in the city and a must-visit place if you want to see just how impressive and successful the Normans were at ruling Sicily.

And of course, as you explore Palermo, be sure to check out the , a palace built in the 9th century and has served as a royal residence, a palace of justice, and a seat of the government over the centuries since the Normans to this day. It is a great place to dive deeper into the history of Palermo if you want to learn more about it.",,,,3,2,12,2,2,7,2,3,2,4,1,2026-04-07
